Name_name,Google Link Redirect
Ir. SYED FADZIL BIN SYED MOHAMED,https://www.google.com/search?q=Ir.+SYED+FADZIL+BIN+SYED+MOHAMED
Ir. SYED FEISAL ALHADY,https://www.google.com/search?q=Ir.+SYED+FEISAL+ALHADY
Ir. SYED JAAFAR IDID SYED ABDYLLAH IDID,https://www.google.com/search?q=Ir.+SYED+JAAFAR+IDID+SYED+ABDYLLAH+IDID
Ir. SYED NEGUIB B SYED MOHAMED,https://www.google.com/search?q=Ir.+SYED+NEGUIB+B+SYED+MOHAMED
Ir. SYED NURSHADIR B SYED IBRAHIM,https://www.google.com/search?q=Ir.+SYED+NURSHADIR+B+SYED+IBRAHIM
Ir. SYED SALIM BIN SYED ABU BAKAR,https://www.google.com/search?q=Ir.+SYED+SALIM+BIN+SYED+ABU+BAKAR
Ir. SYED ZULKARNAIN SHAH BIN SYED AHMAD KAMAL,https://www.google.com/search?q=Ir.+SYED+ZULKARNAIN+SHAH+BIN+SYED+AHMAD+KAMAL
Ir. T JAYAKUMAR A/L THURAIRAJAH,https://www.google.com/search?q=Ir.+T+JAYAKUMAR+A/L+THURAIRAJAH
Ir. TAI CHAU PENG,https://www.google.com/search?q=Ir.+TAI+CHAU+PENG
Ir. TAJUL SALMAN BIN HASSAN,https://www.google.com/search?q=Ir.+TAJUL+SALMAN+BIN+HASSAN
Ir. TAJUL ZAHARI BIN ABU BAKAR,https://www.google.com/search?q=Ir.+TAJUL+ZAHARI+BIN+ABU+BAKAR
Ir. TAM PAK LAN,https://www.google.com/search?q=Ir.+TAM+PAK+LAN
Ir. TAM SHUI YEN @ TAN SHUI YEN,https://www.google.com/search?q=Ir.+TAM+SHUI+YEN+@+TAN+SHUI+YEN
Ir. TAN BAK PING,https://www.google.com/search?q=Ir.+TAN+BAK+PING
Ir. TAN BEE WAH,https://www.google.com/search?q=Ir.+TAN+BEE+WAH
Ir. TAN BENG HUAT (B),https://www.google.com/search?q=Ir.+TAN+BENG+HUAT+(B)
Ir. Tan boon khong,https://www.google.com/search?q=Ir.+Tan+boon+khong
Ir. TAN BOON TIONG,https://www.google.com/search?q=Ir.+TAN+BOON+TIONG
Ir. TAN BOON TONG,https://www.google.com/search?q=Ir.+TAN+BOON+TONG
Ir. TAN CHEE HIN ERIC,https://www.google.com/search?q=Ir.+TAN+CHEE+HIN+ERIC
Ir. TAN CHEE HSIANG,https://www.google.com/search?q=Ir.+TAN+CHEE+HSIANG
Ir. TAN CHEE KIAN (B),https://www.google.com/search?q=Ir.+TAN+CHEE+KIAN+(B)
Ir. TAN CHEE KIEN,https://www.google.com/search?q=Ir.+TAN+CHEE+KIEN
Ir. TAN CHEE SENG,https://www.google.com/search?q=Ir.+TAN+CHEE+SENG
Ir. TAN CHEE SIONG,https://www.google.com/search?q=Ir.+TAN+CHEE+SIONG
Ir. TAN CHEW,https://www.google.com/search?q=Ir.+TAN+CHEW
Ir. TAN CHEW PENG,https://www.google.com/search?q=Ir.+TAN+CHEW+PENG
Ir. TAN CHIAT JOON,https://www.google.com/search?q=Ir.+TAN+CHIAT+JOON
Ir. TAN CHIN HOCK,https://www.google.com/search?q=Ir.+TAN+CHIN+HOCK
Ir. TAN CHIN HWA,https://www.google.com/search?q=Ir.+TAN+CHIN+HWA
Ir. TAN CHIOO BIN,https://www.google.com/search?q=Ir.+TAN+CHIOO+BIN
Ir. TAN CHOO SIANG,https://www.google.com/search?q=Ir.+TAN+CHOO+SIANG
Ir. TAN CHUAN HO,https://www.google.com/search?q=Ir.+TAN+CHUAN+HO
Ir. TAN CHUN LIANG,https://www.google.com/search?q=Ir.+TAN+CHUN+LIANG
Ir. TAN CHUN TAT,https://www.google.com/search?q=Ir.+TAN+CHUN+TAT
Ir. TAN CHUN WEI,https://www.google.com/search?q=Ir.+TAN+CHUN+WEI
Ir. TAN ENG TONG,https://www.google.com/search?q=Ir.+TAN+ENG+TONG
Ir. TAN HENG CHOONG,https://www.google.com/search?q=Ir.+TAN+HENG+CHOONG
Ir. TAN HUA CHUN,https://www.google.com/search?q=Ir.+TAN+HUA+CHUN
Ir. TAN HUAI TEK,https://www.google.com/search?q=Ir.+TAN+HUAI+TEK
Ir. TAN HUCK TEE,https://www.google.com/search?q=Ir.+TAN+HUCK+TEE
Ir. TAN JIN KIAT ADRIAN,https://www.google.com/search?q=Ir.+TAN+JIN+KIAT+ADRIAN
Ir. TAN JIN KIONG,https://www.google.com/search?q=Ir.+TAN+JIN+KIONG
Ir. TAN JOE HOE,https://www.google.com/search?q=Ir.+TAN+JOE+HOE
Ir. TAN KHIM BOK,https://www.google.com/search?q=Ir.+TAN+KHIM+BOK
Ir. TAN KIAN KEONG,https://www.google.com/search?q=Ir.+TAN+KIAN+KEONG
Ir. TAN KIEN SENG,https://www.google.com/search?q=Ir.+TAN+KIEN+SENG
Ir. TAN KIM SENG,https://www.google.com/search?q=Ir.+TAN+KIM+SENG
Ir. TAN KIM THIN,https://www.google.com/search?q=Ir.+TAN+KIM+THIN
Ir. TAN KOK HEE,https://www.google.com/search?q=Ir.+TAN+KOK+HEE
Ir. TAN LI ZHI,https://www.google.com/search?q=Ir.+TAN+LI+ZHI
Ir. TAN LIP LEONG,https://www.google.com/search?q=Ir.+TAN+LIP+LEONG
Ir. TAN MENG JIN,https://www.google.com/search?q=Ir.+TAN+MENG+JIN
Ir. TAN PEY HWAN,https://www.google.com/search?q=Ir.+TAN+PEY+HWAN
Ir. TAN PIN YUAN,https://www.google.com/search?q=Ir.+TAN+PIN+YUAN
Ir. TAN SAY YIAM,https://www.google.com/search?q=Ir.+TAN+SAY+YIAM
Ir. TAN SI LIM,https://www.google.com/search?q=Ir.+TAN+SI+LIM
Ir. TAN SOON LIANG,https://www.google.com/search?q=Ir.+TAN+SOON+LIANG
Ir. TAN SU LENG,https://www.google.com/search?q=Ir.+TAN+SU+LENG
Ir. TAN SUH YONG,https://www.google.com/search?q=Ir.+TAN+SUH+YONG
Ir. TAN TEONG JIN,https://www.google.com/search?q=Ir.+TAN+TEONG+JIN
Ir. TAN THEAN HOCK,https://www.google.com/search?q=Ir.+TAN+THEAN+HOCK
Ir. TAN WAI HONG,https://www.google.com/search?q=Ir.+TAN+WAI+HONG
Ir. TAN WEE KEONG,https://www.google.com/search?q=Ir.+TAN+WEE+KEONG
Ir. TANG CHEE YONG,https://www.google.com/search?q=Ir.+TANG+CHEE+YONG
Ir. TANG CHIN CHUAI,https://www.google.com/search?q=Ir.+TANG+CHIN+CHUAI
Ir. TANG CHIN TAN,https://www.google.com/search?q=Ir.+TANG+CHIN+TAN
Ir. TANG JENQ HANN @TAN JENQ HANN,https://www.google.com/search?q=Ir.+TANG+JENQ+HANN+@TAN+JENQ+HANN
Ir. TANG KHENG SIONG,https://www.google.com/search?q=Ir.+TANG+KHENG+SIONG
Ir. TANG KWANG,https://www.google.com/search?q=Ir.+TANG+KWANG
Ir. TANG SOO HA,https://www.google.com/search?q=Ir.+TANG+SOO+HA
Ir. TANG TAI TENG,https://www.google.com/search?q=Ir.+TANG+TAI+TENG
Ir. TANG THEAM HOOI,https://www.google.com/search?q=Ir.+TANG+THEAM+HOOI
Ir. TANG TING FOONG,https://www.google.com/search?q=Ir.+TANG+TING+FOONG
Ir. TANG TUNG PIN,https://www.google.com/search?q=Ir.+TANG+TUNG+PIN
Ir. TAY GEE YONG,https://www.google.com/search?q=Ir.+TAY+GEE+YONG
Ir. TAY KAR TEIK,https://www.google.com/search?q=Ir.+TAY+KAR+TEIK
Ir. TAY KEONG KIAU,https://www.google.com/search?q=Ir.+TAY+KEONG+KIAU
Ir. TAY KIAN KOK,https://www.google.com/search?q=Ir.+TAY+KIAN+KOK
Ir. TAY KIM CHEE,https://www.google.com/search?q=Ir.+TAY+KIM+CHEE
Ir. TAY KU WAH,https://www.google.com/search?q=Ir.+TAY+KU+WAH
Ir. TAY LEE SIEN,https://www.google.com/search?q=Ir.+TAY+LEE+SIEN
Ir. TAY TECK BENG,https://www.google.com/search?q=Ir.+TAY+TECK+BENG
Ir. TEE KEE POW,https://www.google.com/search?q=Ir.+TEE+KEE+POW
Ir. TEE WEE SONG,https://www.google.com/search?q=Ir.+TEE+WEE+SONG
Ir. TEH BENG SENG,https://www.google.com/search?q=Ir.+TEH+BENG+SENG
Ir. TEH BOON CHIEW,https://www.google.com/search?q=Ir.+TEH+BOON+CHIEW
Ir. TEH LAI SAN,https://www.google.com/search?q=Ir.+TEH+LAI+SAN
Ir. TEH PIAW NGI,https://www.google.com/search?q=Ir.+TEH+PIAW+NGI
Ir. TEH SEE TEE,https://www.google.com/search?q=Ir.+TEH+SEE+TEE
Ir. TEH SENG HOO,https://www.google.com/search?q=Ir.+TEH+SENG+HOO
Ir. TEH TEOH HAI,https://www.google.com/search?q=Ir.+TEH+TEOH+HAI
Ir. TENGKU AHMAD NAZEEM BIN TENGKU ABDUL RAHIM,https://www.google.com/search?q=Ir.+TENGKU+AHMAD+NAZEEM+BIN+TENGKU+ABDUL+RAHIM
Ir. TENGKU HAZIAN TENGKU AB HAMID,https://www.google.com/search?q=Ir.+TENGKU+HAZIAN+TENGKU+AB+HAMID
Ir. TENGKU MOHD FARIS BIN TENGKU OTHMAN,https://www.google.com/search?q=Ir.+TENGKU+MOHD+FARIS+BIN+TENGKU+OTHMAN
Ir. TEO KOK THYE,https://www.google.com/search?q=Ir.+TEO+KOK+THYE
Ir. TEO KUANG KIM,https://www.google.com/search?q=Ir.+TEO+KUANG+KIM
Ir. TEO SAY AUN,https://www.google.com/search?q=Ir.+TEO+SAY+AUN
Ir. TEO YEN BIN,https://www.google.com/search?q=Ir.+TEO+YEN+BIN
Ir. TEOH CHIN HAN,https://www.google.com/search?q=Ir.+TEOH+CHIN+HAN
Ir. TEOH KAH HUAT,https://www.google.com/search?q=Ir.+TEOH+KAH+HUAT
Ir. TEOH KHAI SENG,https://www.google.com/search?q=Ir.+TEOH+KHAI+SENG
Ir. TEOH SEOW MENG,https://www.google.com/search?q=Ir.+TEOH+SEOW+MENG
Ir. TEOH TEONG LIANG,https://www.google.com/search?q=Ir.+TEOH+TEONG+LIANG
Ir. TEOW LOO YIH,https://www.google.com/search?q=Ir.+TEOW+LOO+YIH
Ir. TER LEONG LENG,https://www.google.com/search?q=Ir.+TER+LEONG+LENG
Ir. TEY MING REN,https://www.google.com/search?q=Ir.+TEY+MING+REN
Ir. TEYO ENG CHONG,https://www.google.com/search?q=Ir.+TEYO+ENG+CHONG
Ir. THAM CHI MENG,https://www.google.com/search?q=Ir.+THAM+CHI+MENG
Ir. THAM KIN YON,https://www.google.com/search?q=Ir.+THAM+KIN+YON
Ir. THAM WENG CHOUN,https://www.google.com/search?q=Ir.+THAM+WENG+CHOUN
Ir. THAN SHEAU WEI,https://www.google.com/search?q=Ir.+THAN+SHEAU+WEI
Ir. THANARAJ A/L THAVAMANI,https://www.google.com/search?q=Ir.+THANARAJ+A/L+THAVAMANI
Ir. THARMASEELAN A/L THANABALASINGAM,https://www.google.com/search?q=Ir.+THARMASEELAN+A/L+THANABALASINGAM
Ir. THAVARAJAN MUTHIAH PILLAI,https://www.google.com/search?q=Ir.+THAVARAJAN+MUTHIAH+PILLAI
Ir. THIN CHOON CHAI,https://www.google.com/search?q=Ir.+THIN+CHOON+CHAI
Ir. THIN VOON TUCK,https://www.google.com/search?q=Ir.+THIN+VOON+TUCK
Ir. THIRUMALAICHELVAM SUBRAMANIAM,https://www.google.com/search?q=Ir.+THIRUMALAICHELVAM+SUBRAMANIAM
Ir. THIRUMURUGAN A/L MANIKAM,https://www.google.com/search?q=Ir.+THIRUMURUGAN+A/L+MANIKAM
Ir. THOMAS GEORGE,https://www.google.com/search?q=Ir.+THOMAS+GEORGE
Ir. TIA SHEN CHING,https://www.google.com/search?q=Ir.+TIA+SHEN+CHING
Ir. TIAH OON LING,https://www.google.com/search?q=Ir.+TIAH+OON+LING
Ir. TIAN FOON HOWE,https://www.google.com/search?q=Ir.+TIAN+FOON+HOWE
Ir. TIAN FUNG WANG,https://www.google.com/search?q=Ir.+TIAN+FUNG+WANG
Ir. TING CHIONG TUONG,https://www.google.com/search?q=Ir.+TING+CHIONG+TUONG
Ir. TING HUAT WEI,https://www.google.com/search?q=Ir.+TING+HUAT+WEI
Ir. TIONG BOON KEONG,https://www.google.com/search?q=Ir.+TIONG+BOON+KEONG
Ir. TIONG KING SIONG ANTHONY,https://www.google.com/search?q=Ir.+TIONG+KING+SIONG+ANTHONY
Ir. TIONG TIUNG POH,https://www.google.com/search?q=Ir.+TIONG+TIUNG+POH
Ir. TNAY CHOON HWA,https://www.google.com/search?q=Ir.+TNAY+CHOON+HWA
Ir. TOH SENG KOR,https://www.google.com/search?q=Ir.+TOH+SENG+KOR
Ir. TONG NAM KHONG,https://www.google.com/search?q=Ir.+TONG+NAM+KHONG
Ir. TONG SENG WON,https://www.google.com/search?q=Ir.+TONG+SENG+WON
Ir. TONG TSHEN JUI,https://www.google.com/search?q=Ir.+TONG+TSHEN+JUI
Ir. Toong Yu Ewe,https://www.google.com/search?q=Ir.+Toong+Yu+Ewe
Ir. TUNG KIN CHOONG,https://www.google.com/search?q=Ir.+TUNG+KIN+CHOONG
Ir. TYAH JUN HAO,https://www.google.com/search?q=Ir.+TYAH+JUN+HAO
Ir. UDHAYAKUMAR S/O POOVALINGAM,https://www.google.com/search?q=Ir.+UDHAYAKUMAR+S/O+POOVALINGAM
Ir. UNAZIE ISKANDAR BIN ABD RAZAK,https://www.google.com/search?q=Ir.+UNAZIE+ISKANDAR+BIN+ABD+RAZAK
Ir. UNG SING KWONG,https://www.google.com/search?q=Ir.+UNG+SING+KWONG
Ir. UTHAN ANAK CHUAT,https://www.google.com/search?q=Ir.+UTHAN+ANAK+CHUAT
Ir. VALENTINE ANAK GLAYAN,https://www.google.com/search?q=Ir.+VALENTINE+ANAK+GLAYAN
Ir. VASAN A/L MARIAPPAN,https://www.google.com/search?q=Ir.+VASAN+A/L+MARIAPPAN
Ir. VASANTHATHIBAN PERIASAMY,https://www.google.com/search?q=Ir.+VASANTHATHIBAN+PERIASAMY
Ir. VEERANDRAN A/L RAJAPPAN,https://www.google.com/search?q=Ir.+VEERANDRAN+A/L+RAJAPPAN
Ir. VEKNESWARAN A/L T ARASAPPAN,https://www.google.com/search?q=Ir.+VEKNESWARAN+A/L+T+ARASAPPAN
Ir. VENOTH KUMAR A/L GOVINDASAMY,https://www.google.com/search?q=Ir.+VENOTH+KUMAR+A/L+GOVINDASAMY
Ir. VICTOR CHIN JUN HOCK,https://www.google.com/search?q=Ir.+VICTOR+CHIN+JUN+HOCK
Ir. VICTORIA PETER,https://www.google.com/search?q=Ir.+VICTORIA+PETER
Ir. VIJAYAN A/L GOPALAKRISHNAN,https://www.google.com/search?q=Ir.+VIJAYAN+A/L+GOPALAKRISHNAN
Ir. VISHNUVARMAN A/L ARUGANAN,https://www.google.com/search?q=Ir.+VISHNUVARMAN+A/L+ARUGANAN
Ir. VISWAM RAJARATNAM,https://www.google.com/search?q=Ir.+VISWAM+RAJARATNAM
Ir. VUN YIT KONG,https://www.google.com/search?q=Ir.+VUN+YIT+KONG
Ir. WAKI' BIN MOHAMAD,https://www.google.com/search?q=Ir.+WAKI'+BIN+MOHAMAD
Ir. WAN ADIL BIN WAN ADLI,https://www.google.com/search?q=Ir.+WAN+ADIL+BIN+WAN+ADLI
Ir. WAN HAZRI BIN WAN MUSTAFA,https://www.google.com/search?q=Ir.+WAN+HAZRI+BIN+WAN+MUSTAFA
Ir. WAN KHAIRUL ANNUAR BIN WAN SALLEH,https://www.google.com/search?q=Ir.+WAN+KHAIRUL+ANNUAR+BIN+WAN+SALLEH
Ir. WAN MALIKI BIN WAN MUHAMMAD,https://www.google.com/search?q=Ir.+WAN+MALIKI+BIN+WAN+MUHAMMAD
Ir. WAN MOHAMAD NASBI BIN WAN MOHAMAD,https://www.google.com/search?q=Ir.+WAN+MOHAMAD+NASBI+BIN+WAN+MOHAMAD
Ir. WAN MOHAMMAD ALAM WAN HANAFI,https://www.google.com/search?q=Ir.+WAN+MOHAMMAD+ALAM+WAN+HANAFI
Ir. WAN MOHD FAUZI B WAN SULAIMAN,https://www.google.com/search?q=Ir.+WAN+MOHD+FAUZI+B+WAN+SULAIMAN
Ir. WAN MOHD HATIM HJ WAN ABDULLAH,https://www.google.com/search?q=Ir.+WAN+MOHD+HATIM+HJ+WAN+ABDULLAH
Ir. WAN MOHD KAMIL BIN WAN IBRAHIM,https://www.google.com/search?q=Ir.+WAN+MOHD+KAMIL+BIN+WAN+IBRAHIM
Ir. WAN MOHD ZAID BIN SALLEH,https://www.google.com/search?q=Ir.+WAN+MOHD+ZAID+BIN+SALLEH
Ir. WAN MUHAMMAD NIZAM WAN AFFANDI,https://www.google.com/search?q=Ir.+WAN+MUHAMMAD+NIZAM+WAN+AFFANDI
Ir. WAN MUZAFFAR BIN WAN MUHAMMAD,https://www.google.com/search?q=Ir.+WAN+MUZAFFAR+BIN+WAN+MUHAMMAD
Ir. WAN NORAZRI BIN AB AZIZ,https://www.google.com/search?q=Ir.+WAN+NORAZRI+BIN+AB+AZIZ
Ir. WAN RIZALUDDIN ABDULLAH B WAN ALI,https://www.google.com/search?q=Ir.+WAN+RIZALUDDIN+ABDULLAH+B+WAN+ALI
Ir. WAN RUMAIZEE B WAN AB SAAMBAR @ ZA'ABAR,https://www.google.com/search?q=Ir.+WAN+RUMAIZEE+B+WAN+AB+SAAMBAR+@+ZA'ABAR
Ir. WAN SABRI BIN WAN AHMAD,https://www.google.com/search?q=Ir.+WAN+SABRI+BIN+WAN+AHMAD
Ir. WAN SAPIANSORI BIN WAN ABD GHANI,https://www.google.com/search?q=Ir.+WAN+SAPIANSORI+BIN+WAN+ABD+GHANI
Ir. WAN SHAH WALIALLAH BIN WAN MAT ZAIN @ WAN SENIK,https://www.google.com/search?q=Ir.+WAN+SHAH+WALIALLAH+BIN+WAN+MAT+ZAIN+@+WAN+SENIK
Ir. WAN ZAIDILFITRI B WAN MAT ZAIN,https://www.google.com/search?q=Ir.+WAN+ZAIDILFITRI+B+WAN+MAT+ZAIN
Ir. WANG LEONG HONG @ WONG LEONG HONG,https://www.google.com/search?q=Ir.+WANG+LEONG+HONG+@+WONG+LEONG+HONG
Ir. WEE CHONG ENG,https://www.google.com/search?q=Ir.+WEE+CHONG+ENG
Ir. WEE MUN TONG,https://www.google.com/search?q=Ir.+WEE+MUN+TONG
Ir. WILLIAM WERA LUKAM,https://www.google.com/search?q=Ir.+WILLIAM+WERA+LUKAM
Ir. WONG CHEE KIONG,https://www.google.com/search?q=Ir.+WONG+CHEE+KIONG
Ir. WONG CHEE KONG,https://www.google.com/search?q=Ir.+WONG+CHEE+KONG
Ir. WONG CHOK VAI,https://www.google.com/search?q=Ir.+WONG+CHOK+VAI
Ir. WONG CHOON YOONG,https://www.google.com/search?q=Ir.+WONG+CHOON+YOONG
Ir. WONG HUAN YONG,https://www.google.com/search?q=Ir.+WONG+HUAN+YONG
Ir. WONG KHEE VEAI,https://www.google.com/search?q=Ir.+WONG+KHEE+VEAI
Ir. WONG KIAT CHOONG,https://www.google.com/search?q=Ir.+WONG+KIAT+CHOONG
Ir. WONG KIEN FATT,https://www.google.com/search?q=Ir.+WONG+KIEN+FATT
Ir. WONG KIN MENG,https://www.google.com/search?q=Ir.+WONG+KIN+MENG
Ir. WONG KIN WING,https://www.google.com/search?q=Ir.+WONG+KIN+WING
Ir. WONG KOH SANG,https://www.google.com/search?q=Ir.+WONG+KOH+SANG
Ir. WONG KUEN CAN,https://www.google.com/search?q=Ir.+WONG+KUEN+CAN
Ir. WONG LING TUNG,https://www.google.com/search?q=Ir.+WONG+LING+TUNG
Ir. WONG MUN CHONG,https://www.google.com/search?q=Ir.+WONG+MUN+CHONG
Ir. WONG NAM YUN,https://www.google.com/search?q=Ir.+WONG+NAM+YUN
Ir. WONG NGIAP KIN (A),https://www.google.com/search?q=Ir.+WONG+NGIAP+KIN+(A)
Ir. WONG SAU HOONG,https://www.google.com/search?q=Ir.+WONG+SAU+HOONG
Ir. WONG SEE FOONG,https://www.google.com/search?q=Ir.+WONG+SEE+FOONG
Ir. WONG SHIAN CHING,https://www.google.com/search?q=Ir.+WONG+SHIAN+CHING
Ir. WONG SIAO HAW,https://www.google.com/search?q=Ir.+WONG+SIAO+HAW
Ir. WONG SIEW SHENG,https://www.google.com/search?q=Ir.+WONG+SIEW+SHENG
Ir. WONG SIN FUTT,https://www.google.com/search?q=Ir.+WONG+SIN+FUTT
Ir. WONG SWEE ON,https://www.google.com/search?q=Ir.+WONG+SWEE+ON
Ir. WONG TIEN SOONG,https://www.google.com/search?q=Ir.+WONG+TIEN+SOONG
Ir. WONG TUCK YOON,https://www.google.com/search?q=Ir.+WONG+TUCK+YOON
Ir. WONG TUNG MING,https://www.google.com/search?q=Ir.+WONG+TUNG+MING
Ir. WONG VUN CHING,https://www.google.com/search?q=Ir.+WONG+VUN+CHING
Ir. WONG WAI MUN,https://www.google.com/search?q=Ir.+WONG+WAI+MUN
Ir. WONG WEN ANG,https://www.google.com/search?q=Ir.+WONG+WEN+ANG
Ir. WONG WIN HENG,https://www.google.com/search?q=Ir.+WONG+WIN+HENG
Ir. WONG YEE FOONG,https://www.google.com/search?q=Ir.+WONG+YEE+FOONG
Ir. WONG YIING,https://www.google.com/search?q=Ir.+WONG+YIING
Ir. WOO AH KEONG,https://www.google.com/search?q=Ir.+WOO+AH+KEONG
Ir. WOO KWONG HING,https://www.google.com/search?q=Ir.+WOO+KWONG+HING
Ir. WOO KWONG LEONG,https://www.google.com/search?q=Ir.+WOO+KWONG+LEONG
Ir. WU SWEE SCHWANG JIMMY,https://www.google.com/search?q=Ir.+WU+SWEE+SCHWANG+JIMMY
Ir. WU SWEE WENG,https://www.google.com/search?q=Ir.+WU+SWEE+WENG
Ir. WU TA HONG,https://www.google.com/search?q=Ir.+WU+TA+HONG
Ir. YAACOB BIN SALIM,https://www.google.com/search?q=Ir.+YAACOB+BIN+SALIM
Ir. YACOB BIN ALI,https://www.google.com/search?q=Ir.+YACOB+BIN+ALI
Ir. YAHAYA BIN RAMLI,https://www.google.com/search?q=Ir.+YAHAYA+BIN+RAMLI
Ir. YAHYA BIN MOHAMED YATIM,https://www.google.com/search?q=Ir.+YAHYA+BIN+MOHAMED+YATIM
Ir. YAHYATU NIZAM BIN YAHAYA,https://www.google.com/search?q=Ir.+YAHYATU+NIZAM+BIN+YAHAYA
Ir. YAP BIEW SING,https://www.google.com/search?q=Ir.+YAP+BIEW+SING
Ir. YAP CHEE FONG,https://www.google.com/search?q=Ir.+YAP+CHEE+FONG
Ir. YAP CHEE HONG,https://www.google.com/search?q=Ir.+YAP+CHEE+HONG
Ir. YAP CHEE KWANG,https://www.google.com/search?q=Ir.+YAP+CHEE+KWANG
Ir. YAP CHENG AUN,https://www.google.com/search?q=Ir.+YAP+CHENG+AUN
Ir. YAP CHO FAH,https://www.google.com/search?q=Ir.+YAP+CHO+FAH
Ir. YAP CHONG HONG,https://www.google.com/search?q=Ir.+YAP+CHONG+HONG
Ir. YAP CHOONG SEONG,https://www.google.com/search?q=Ir.+YAP+CHOONG+SEONG
Ir. YAP FOO KWONG,https://www.google.com/search?q=Ir.+YAP+FOO+KWONG
Ir. YAP HONG EN,https://www.google.com/search?q=Ir.+YAP+HONG+EN
Ir. YAP SIEW CHOONG,https://www.google.com/search?q=Ir.+YAP+SIEW+CHOONG
Ir. YAP WEE KEONG,https://www.google.com/search?q=Ir.+YAP+WEE+KEONG
Ir. YAP WENG SUON,https://www.google.com/search?q=Ir.+YAP+WENG+SUON
Ir. YAP WOOI KIEN,https://www.google.com/search?q=Ir.+YAP+WOOI+KIEN
Ir. YAP YOON LOY,https://www.google.com/search?q=Ir.+YAP+YOON+LOY
Ir. YATIM SELAMAT BIN LATIB,https://www.google.com/search?q=Ir.+YATIM+SELAMAT+BIN+LATIB
Ir. YAU CHUAN SIM,https://www.google.com/search?q=Ir.+YAU+CHUAN+SIM
Ir. YAW TIAM LAI,https://www.google.com/search?q=Ir.+YAW+TIAM+LAI
Ir. YEAP CHOO HONG,https://www.google.com/search?q=Ir.+YEAP+CHOO+HONG
Ir. YEE CHOON KIAT,https://www.google.com/search?q=Ir.+YEE+CHOON+KIAT
Ir. YEE CHUN KIET,https://www.google.com/search?q=Ir.+YEE+CHUN+KIET
Ir. YEE HOOI SENG,https://www.google.com/search?q=Ir.+YEE+HOOI+SENG
Ir. YEE KEAT CHOY,https://www.google.com/search?q=Ir.+YEE+KEAT+CHOY
Ir. YENG CHUAN BUU @ AH BU,https://www.google.com/search?q=Ir.+YENG+CHUAN+BUU+@+AH+BU
Ir. YENG FOOK CHEK,https://www.google.com/search?q=Ir.+YENG+FOOK+CHEK
Ir. YEOH CHIEN WERN,https://www.google.com/search?q=Ir.+YEOH+CHIEN+WERN
Ir. YEOH GHIM HWA,https://www.google.com/search?q=Ir.+YEOH+GHIM+HWA
Ir. YEOH JIT SHIONG,https://www.google.com/search?q=Ir.+YEOH+JIT+SHIONG
Ir. YEOH YEN SHIONG,https://www.google.com/search?q=Ir.+YEOH+YEN+SHIONG
Ir. YEW HOO SANG,https://www.google.com/search?q=Ir.+YEW+HOO+SANG
Ir. YEW KIAN TEONG,https://www.google.com/search?q=Ir.+YEW+KIAN+TEONG
Ir. YEW YEOW SOON,https://www.google.com/search?q=Ir.+YEW+YEOW+SOON
Ir. YII HUONG SWEE,https://www.google.com/search?q=Ir.+YII+HUONG+SWEE
Ir. YIM HON WA,https://www.google.com/search?q=Ir.+YIM+HON+WA
Ir. YIP FOOK KEONG,https://www.google.com/search?q=Ir.+YIP+FOOK+KEONG
Ir. YOH SOW CHEONG,https://www.google.com/search?q=Ir.+YOH+SOW+CHEONG
Ir. YOKE LEE TAN,https://www.google.com/search?q=Ir.+YOKE+LEE+TAN
Ir. YONG CHEN WEI,https://www.google.com/search?q=Ir.+YONG+CHEN+WEI
Ir. YONG KOK HOE,https://www.google.com/search?q=Ir.+YONG+KOK+HOE
Ir. YONG OON FATT,https://www.google.com/search?q=Ir.+YONG+OON+FATT
Ir. YONG YEW WEI,https://www.google.com/search?q=Ir.+YONG+YEW+WEI
Ir. YOONG KEE SIN,https://www.google.com/search?q=Ir.+YOONG+KEE+SIN
Ir. YU SUEN KEAT,https://www.google.com/search?q=Ir.+YU+SUEN+KEAT
Ir. YUEN CHENG PIOU,https://www.google.com/search?q=Ir.+YUEN+CHENG+PIOU
Ir. YUSMAN BIN DAUD,https://www.google.com/search?q=Ir.+YUSMAN+BIN+DAUD
Ir. YUSNIZA BT YEM,https://www.google.com/search?q=Ir.+YUSNIZA+BT+YEM
Ir. YUSOF BIN MOHD SANI,https://www.google.com/search?q=Ir.+YUSOF+BIN+MOHD+SANI
Ir. YUSPIKARL BIN ADNAN,https://www.google.com/search?q=Ir.+YUSPIKARL+BIN+ADNAN
Ir. YUSRI BIN AHMAT,https://www.google.com/search?q=Ir.+YUSRI+BIN+AHMAT
Ir. ZAHAL BIN MOHAMED,https://www.google.com/search?q=Ir.+ZAHAL+BIN+MOHAMED
Ir. ZAHARI BIN SAMAT,https://www.google.com/search?q=Ir.+ZAHARI+BIN+SAMAT
Ir. ZAIDAH BINTI IDRIS,https://www.google.com/search?q=Ir.+ZAIDAH+BINTI+IDRIS
Ir. ZAIDI BIN ABDULLAH,https://www.google.com/search?q=Ir.+ZAIDI+BIN+ABDULLAH
Ir. ZAIDI BIN ABU BAKAR,https://www.google.com/search?q=Ir.+ZAIDI+BIN+ABU+BAKAR
Ir. ZAIDI BIN AYUB,https://www.google.com/search?q=Ir.+ZAIDI+BIN+AYUB
Ir. ZAIDI BIN SHAHOR,https://www.google.com/search?q=Ir.+ZAIDI+BIN+SHAHOR
Ir. ZAILANI BIN NAGIN,https://www.google.com/search?q=Ir.+ZAILANI+BIN+NAGIN
Ir. ZAIMI BIN ZAHARI,https://www.google.com/search?q=Ir.+ZAIMI+BIN+ZAHARI
Ir. ZAINAL ABIDIN B KAMARUL BAHARIN,https://www.google.com/search?q=Ir.+ZAINAL+ABIDIN+B+KAMARUL+BAHARIN
Ir. ZAINOL ABIDIN BIN AWANG SA,https://www.google.com/search?q=Ir.+ZAINOL+ABIDIN+BIN+AWANG+SA
Ir. ZAINOL ARIFEN BIN SAID,https://www.google.com/search?q=Ir.+ZAINOL+ARIFEN+BIN+SAID
Ir. ZAINUDDIN BIN MOHAMAD,https://www.google.com/search?q=Ir.+ZAINUDDIN+BIN+MOHAMAD
Ir. ZAINUDDIN BIN OSMAN,https://www.google.com/search?q=Ir.+ZAINUDDIN+BIN+OSMAN
Ir. ZAINUDDIN BIN ZAKARIA @ ZAHARI,https://www.google.com/search?q=Ir.+ZAINUDDIN+BIN+ZAKARIA+@+ZAHARI
Ir. ZAIRY JUAZRY BIN ZAKI @ MOHD ZAKI,https://www.google.com/search?q=Ir.+ZAIRY+JUAZRY+BIN+ZAKI+@+MOHD+ZAKI
Ir. ZAISMADI BIN ISMAIL,https://www.google.com/search?q=Ir.+ZAISMADI+BIN+ISMAIL
Ir. ZAKARIA BIN ABDULLAH,https://www.google.com/search?q=Ir.+ZAKARIA+BIN+ABDULLAH
Ir. ZAKARIA BIN AWANG,https://www.google.com/search?q=Ir.+ZAKARIA+BIN+AWANG
Ir. ZAKARIA BIN JASIN,https://www.google.com/search?q=Ir.+ZAKARIA+BIN+JASIN
Ir. ZAKI BIN ANHAR,https://www.google.com/search?q=Ir.+ZAKI+BIN+ANHAR
Ir. ZALIZAN B MOHAMED NOR @ KAMARUZAMAN,https://www.google.com/search?q=Ir.+ZALIZAN+B+MOHAMED+NOR+@+KAMARUZAMAN
Ir. ZAMANI BIN MOHD SALLEH,https://www.google.com/search?q=Ir.+ZAMANI+BIN+MOHD+SALLEH
Ir. ZAMRI BIN KANIP,https://www.google.com/search?q=Ir.+ZAMRI+BIN+KANIP
Ir. ZAMZURI BIN AZIZ,https://www.google.com/search?q=Ir.+ZAMZURI+BIN+AZIZ
Ir. ZAMZURIN BIN MAAROF,https://www.google.com/search?q=Ir.+ZAMZURIN+BIN+MAAROF
Ir. ZARIR RAMIZ BIN MUSTAFA,https://www.google.com/search?q=Ir.+ZARIR+RAMIZ+BIN+MUSTAFA
Ir. ZEMA ZAMANEE BIN MAT SAAD,https://www.google.com/search?q=Ir.+ZEMA+ZAMANEE+BIN+MAT+SAAD
Ir. ZULFAHMI BIN AZIZ,https://www.google.com/search?q=Ir.+ZULFAHMI+BIN+AZIZ
Ir. ZULHADI BIN ROSDI,https://www.google.com/search?q=Ir.+ZULHADI+BIN+ROSDI
Ir. ZULKAFLI BIN MAT RANI,https://www.google.com/search?q=Ir.+ZULKAFLI+BIN+MAT+RANI
Ir. ZULKARNAIN BIN MAT ARIFFIN,https://www.google.com/search?q=Ir.+ZULKARNAIN+BIN+MAT+ARIFFIN
Ir. ZULKEFLI BIN MAT SAIN,https://www.google.com/search?q=Ir.+ZULKEFLI+BIN+MAT+SAIN
Ir. ZULKEFLY BIN MOHD YUSOF,https://www.google.com/search?q=Ir.+ZULKEFLY+BIN+MOHD+YUSOF
Ir. ZULKIFLI BIN ABDUL RASHAD,https://www.google.com/search?q=Ir.+ZULKIFLI+BIN+ABDUL+RASHAD
Ir. ZULKIFLI BIN ABDUL SHUKOR,https://www.google.com/search?q=Ir.+ZULKIFLI+BIN+ABDUL+SHUKOR
Ir. ZULKIFLI BIN AHMAD,https://www.google.com/search?q=Ir.+ZULKIFLI+BIN+AHMAD
Ir. ZULKIFLI BIN AHMAD AHTAR,https://www.google.com/search?q=Ir.+ZULKIFLI+BIN+AHMAD+AHTAR
Ir. ZULKIFLY BIN HASSAN,https://www.google.com/search?q=Ir.+ZULKIFLY+BIN+HASSAN
Ir. ZURAIDI HANAFI BIN HANAFI,https://www.google.com/search?q=Ir.+ZURAIDI+HANAFI+BIN+HANAFI
Ir. ZURAINI BIN MOHD JALI,https://www.google.com/search?q=Ir.+ZURAINI+BIN+MOHD+JALI
KAPTEN Ir. SELVARAJAH ARASU RMN (RTD),https://www.google.com/search?q=KAPTEN+Ir.+SELVARAJAH+ARASU+RMN+(RTD)
KOL (B) Ir. MOHD PAUZI BIN DERIS,https://www.google.com/search?q=KOL+(B)+Ir.+MOHD+PAUZI+BIN+DERIS
KOL. Ir. SUTHAN A/L VENKATACHALAM,https://www.google.com/search?q=KOL.+Ir.+SUTHAN+A/L+VENKATACHALAM
KOMANDER Ir. SHAHRIMAN BIN SHAWALUDDIN,https://www.google.com/search?q=KOMANDER+Ir.+SHAHRIMAN+BIN+SHAWALUDDIN
LT CDR (B) LEE CHONG CHIANG,https://www.google.com/search?q=LT+CDR+(B)+LEE+CHONG+CHIANG
LT KOL Ir. ABDUL RAZAK BIN AHMAD,https://www.google.com/search?q=LT+KOL+Ir.+ABDUL+RAZAK+BIN+AHMAD
LT KOL Ir. MOHD HAZANI BIN HAJI SHAFIE,https://www.google.com/search?q=LT+KOL+Ir.+MOHD+HAZANI+BIN+HAJI+SHAFIE
LT KOL Ir. MOHD SHAHRUL NIZAM MOHD HEDZIR,https://www.google.com/search?q=LT+KOL+Ir.+MOHD+SHAHRUL+NIZAM+MOHD+HEDZIR
MEJ (B) Ir. MOHD GHAZALI BIN ABDULLAH,https://www.google.com/search?q=MEJ+(B)+Ir.+MOHD+GHAZALI+BIN+ABDULLAH
MEJAR (B) Ir. ABDULLAH BIN MOHAMMAD,https://www.google.com/search?q=MEJAR+(B)+Ir.+ABDULLAH+BIN+MOHAMMAD
MEJAR Ir. MUHAMAD BIN ABU KASSIM,https://www.google.com/search?q=MEJAR+Ir.+MUHAMAD+BIN+ABU+KASSIM
PROF. Ir. Dr. ABU BAKAR BIN SULONG,https://www.google.com/search?q=PROF.+Ir.+Dr.+ABU+BAKAR+BIN+SULONG
PROF. Ir. Dr. AHMAD KAMAL ARIFFIN MOHD IHSAN,https://www.google.com/search?q=PROF.+Ir.+Dr.+AHMAD+KAMAL+ARIFFIN+MOHD+IHSAN
PROF. Ir. Dr. AZHAR BIN ABDUL AZIZ,https://www.google.com/search?q=PROF.+Ir.+Dr.+AZHAR+BIN+ABDUL+AZIZ
PROF. Ir. Dr. BARKAWI BIN SAHARI,https://www.google.com/search?q=PROF.+Ir.+Dr.+BARKAWI+BIN+SAHARI
PROF. Ir. Dr. KAMSANI ABDUL MAJID,https://www.google.com/search?q=PROF.+Ir.+Dr.+KAMSANI+ABDUL+MAJID
PROF. Ir. Dr. KANESAN A/L MUTHUSAMY,https://www.google.com/search?q=PROF.+Ir.+Dr.+KANESAN+A/L+MUTHUSAMY
PROF. Ir. Dr. MD YUSOF BIN ISMAIL (C),https://www.google.com/search?q=PROF.+Ir.+Dr.+MD+YUSOF+BIN+ISMAIL+(C)
PROF. Ir. Dr. MOHD SAPUAN BIN SALIT @ SINON,https://www.google.com/search?q=PROF.+Ir.+Dr.+MOHD+SAPUAN+BIN+SALIT+@+SINON
PROF. Ir. Dr. NOOR AZUAN BIN ABU OSMAN,https://www.google.com/search?q=PROF.+Ir.+Dr.+NOOR+AZUAN+BIN+ABU+OSMAN
PROF. Ir. Dr. RAMESH SINGH A/L KULDIP SINGH,https://www.google.com/search?q=PROF.+Ir.+Dr.+RAMESH+SINGH+A/L+KULDIP+SINGH
PROF. Ir. Dr. S KANNAN V KRISHNA,https://www.google.com/search?q=PROF.+Ir.+Dr.+S+KANNAN+V+KRISHNA
