Name_name,Google Link Redirect
ASSOC PROF. Ir. Dr. SAIDDI ALI FIRDAUS B MOHAMED ISHAK,https://www.google.com/search?q=ASSOC+PROF.+Ir.+Dr.+SAIDDI+ALI+FIRDAUS+B+MOHAMED+ISHAK
ASSOC. PROF. IR. DR. MOHD DANIAL BIN IBRAHIM,https://www.google.com/search?q=ASSOC.+PROF.+IR.+DR.+MOHD+DANIAL+BIN+IBRAHIM
BRIG. JEN. DATO' IR. HJ. NAJMUDDIN BIN HJ. JAAFAR (BERSARA),https://www.google.com/search?q=BRIG.+JEN.+DATO'+IR.+HJ.+NAJMUDDIN+BIN+HJ.+JAAFAR+(BERSARA)
DATO' Ir. AHMAD BIN HASSAN,https://www.google.com/search?q=DATO'+Ir.+AHMAD+BIN+HASSAN
DATO' Ir. AHMAD MURAD BIN OMAR,https://www.google.com/search?q=DATO'+Ir.+AHMAD+MURAD+BIN+OMAR
DATO' Ir. CHENG NYEK PAW,https://www.google.com/search?q=DATO'+Ir.+CHENG+NYEK+PAW
DATO' Ir. Dr. ABU BAKAR BIN JAAFAR,https://www.google.com/search?q=DATO'+Ir.+Dr.+ABU+BAKAR+BIN+JAAFAR
DATO' Ir. Dr. MUKHLIS CHUA @ CHUA CHING KOK,https://www.google.com/search?q=DATO'+Ir.+Dr.+MUKHLIS+CHUA+@+CHUA+CHING+KOK
DATO' Ir. Dr. SEO KIAN HAW,https://www.google.com/search?q=DATO'+Ir.+Dr.+SEO+KIAN+HAW
DATO' Ir. FOONG CHOY CHYE,https://www.google.com/search?q=DATO'+Ir.+FOONG+CHOY+CHYE
DATO' Ir. HJ BUDIMAN BIN HJ WAN ISMAIL,https://www.google.com/search?q=DATO'+Ir.+HJ+BUDIMAN+BIN+HJ+WAN+ISMAIL
DATO' Ir. HJ JOHARI BIN JAALAM,https://www.google.com/search?q=DATO'+Ir.+HJ+JOHARI+BIN+JAALAM
DATO' Ir. ISMAIL BIN SAMION,https://www.google.com/search?q=DATO'+Ir.+ISMAIL+BIN+SAMION
DATO' Ir. JAMLUS BIN HAJI AZIZ,https://www.google.com/search?q=DATO'+Ir.+JAMLUS+BIN+HAJI+AZIZ
DATO' Ir. KHAIRUDIN BIN SIDEK,https://www.google.com/search?q=DATO'+Ir.+KHAIRUDIN+BIN+SIDEK
DATO' Ir. LOO SON YONG,https://www.google.com/search?q=DATO'+Ir.+LOO+SON+YONG
DATO' Ir. MUHAMMAD IMRAN BIN BAHARUDDIN,https://www.google.com/search?q=DATO'+Ir.+MUHAMMAD+IMRAN+BIN+BAHARUDDIN
DATO' Ir. NOOR AZMI BIN JAAFAR,https://www.google.com/search?q=DATO'+Ir.+NOOR+AZMI+BIN+JAAFAR
DATO' Ir. THONG KOK SING,https://www.google.com/search?q=DATO'+Ir.+THONG+KOK+SING
DATO' Ir. WAN AB GHAFFAR BIN WAN AHMAD,https://www.google.com/search?q=DATO'+Ir.+WAN+AB+GHAFFAR+BIN+WAN+AHMAD
DATO' Ir. WAN RAZALI BIN WAN MUDA,https://www.google.com/search?q=DATO'+Ir.+WAN+RAZALI+BIN+WAN+MUDA
DATO' PROF. Ir. Dr. ALIAS BIN MOHD NOOR,https://www.google.com/search?q=DATO'+PROF.+Ir.+Dr.+ALIAS+BIN+MOHD+NOOR
DATO' PROF. Ir. Dr. IBRAHIM BIN HUSSEIN,https://www.google.com/search?q=DATO'+PROF.+Ir.+Dr.+IBRAHIM+BIN+HUSSEIN
DATO' PROF. Ir. Dr. MOHAMMED RAFIQ BIN ABDUL KADIR,https://www.google.com/search?q=DATO'+PROF.+Ir.+Dr.+MOHAMMED+RAFIQ+BIN+ABDUL+KADIR
DATUK Ir. ABDUL NASSER BIN ABDUL WAHID,https://www.google.com/search?q=DATUK+Ir.+ABDUL+NASSER+BIN+ABDUL+WAHID
DATUK Ir. Hj. KAMARULZAMAN BIN HJ ZAINAL,https://www.google.com/search?q=DATUK+Ir.+Hj.+KAMARULZAMAN+BIN+HJ+ZAINAL
DATUK Ir. Hj. MOHD KHALID BIN NASIR,https://www.google.com/search?q=DATUK+Ir.+Hj.+MOHD+KHALID+BIN+NASIR
DATUK Ir. RAMAKRISHNAN GOVINDASAMY,https://www.google.com/search?q=DATUK+Ir.+RAMAKRISHNAN+GOVINDASAMY
DATUK Ir. RAZDWAN BIN KASIM,https://www.google.com/search?q=DATUK+Ir.+RAZDWAN+BIN+KASIM
DATUK Ir. WAN NOR AZMAN BIN WAN SALLEH,https://www.google.com/search?q=DATUK+Ir.+WAN+NOR+AZMAN+BIN+WAN+SALLEH
DATUK PROF. Ir. Dr. MOHD JAILANI BIN MOHD NOR,https://www.google.com/search?q=DATUK+PROF.+Ir.+Dr.+MOHD+JAILANI+BIN+MOHD+NOR
Ir. MOHAMMAD NAZRI BIN SULAIMAN,https://www.google.com/search?q=Ir.+MOHAMMAD+NAZRI+BIN+SULAIMAN
Ir. AARON SAW SENG TATT,https://www.google.com/search?q=Ir.+AARON+SAW+SENG+TATT
Ir. AB 'ALIM BIN RUSLAM AHMAD,https://www.google.com/search?q=Ir.+AB+'ALIM+BIN+RUSLAM+AHMAD
Ir. AB WAHAB BIN CHIK,https://www.google.com/search?q=Ir.+AB+WAHAB+BIN+CHIK
Ir. ABANG ASHAARI BIN ABDUL RAHMAN,https://www.google.com/search?q=Ir.+ABANG+ASHAARI+BIN+ABDUL+RAHMAN
Ir. ABANG ASRI BIN ARIFFIN,https://www.google.com/search?q=Ir.+ABANG+ASRI+BIN+ARIFFIN
Ir. ABANG MOHAMAD MOASILI BIN ABG MOHD NAILE,https://www.google.com/search?q=Ir.+ABANG+MOHAMAD+MOASILI+BIN+ABG+MOHD+NAILE
Ir. ABD AZIZ BIN IBRAHIM,https://www.google.com/search?q=Ir.+ABD+AZIZ+BIN+IBRAHIM
Ir. ABD GHANI BIN IBRAHIM,https://www.google.com/search?q=Ir.+ABD+GHANI+BIN+IBRAHIM
Ir. ABD LATIF BIN YAACOB,https://www.google.com/search?q=Ir.+ABD+LATIF+BIN+YAACOB
Ir. ABD MALEK BIN ABU HASSAN,https://www.google.com/search?q=Ir.+ABD+MALEK+BIN+ABU+HASSAN
Ir. ABD RAHIM BIN BAHRUDDIN,https://www.google.com/search?q=Ir.+ABD+RAHIM+BIN+BAHRUDDIN
Ir. ABD RANI BIN AHMAD,https://www.google.com/search?q=Ir.+ABD+RANI+BIN+AHMAD
Ir. ABD RASHID BIN MD SIDEK,https://www.google.com/search?q=Ir.+ABD+RASHID+BIN+MD+SIDEK
Ir. ABD RAZAK BIN ABU HURAIRAH,https://www.google.com/search?q=Ir.+ABD+RAZAK+BIN+ABU+HURAIRAH
Ir. ABD RAZAK BIN HASSAN,https://www.google.com/search?q=Ir.+ABD+RAZAK+BIN+HASSAN
Ir. ABDUL AZIZ BIN JIDON,https://www.google.com/search?q=Ir.+ABDUL+AZIZ+BIN+JIDON
Ir. ABDUL AZIZ BIN KADIR,https://www.google.com/search?q=Ir.+ABDUL+AZIZ+BIN+KADIR
Ir. ABDUL AZIZ BIN MAT ALI,https://www.google.com/search?q=Ir.+ABDUL+AZIZ+BIN+MAT+ALI
Ir. ABDUL AZIZ BIN MOHAMED NOH,https://www.google.com/search?q=Ir.+ABDUL+AZIZ+BIN+MOHAMED+NOH
Ir. ABDUL AZIZ BIN SHAMSUDDIN,https://www.google.com/search?q=Ir.+ABDUL+AZIZ+BIN+SHAMSUDDIN
Ir. ABDUL AZIZ BIN YAHYA,https://www.google.com/search?q=Ir.+ABDUL+AZIZ+BIN+YAHYA
Ir. ABDUL HADIE BIN ABDULLAH,https://www.google.com/search?q=Ir.+ABDUL+HADIE+BIN+ABDULLAH
Ir. ABDUL HALIM BIN SHAMSUDDIN,https://www.google.com/search?q=Ir.+ABDUL+HALIM+BIN+SHAMSUDDIN
Ir. ABDUL HAMID @ HAMID BIN ABDILLAH,https://www.google.com/search?q=Ir.+ABDUL+HAMID+@+HAMID+BIN+ABDILLAH
Ir. ABDUL HAMID BIN MOHAMED ZIN,https://www.google.com/search?q=Ir.+ABDUL+HAMID+BIN+MOHAMED+ZIN
Ir. ABDUL HAMID BIN SULEIMAN,https://www.google.com/search?q=Ir.+ABDUL+HAMID+BIN+SULEIMAN
Ir. ABDUL HANNAN BIN ASHAARI,https://www.google.com/search?q=Ir.+ABDUL+HANNAN+BIN+ASHAARI
Ir. ABDUL LATIF @ ABD RAHMAN BIN MOHAMED,https://www.google.com/search?q=Ir.+ABDUL+LATIF+@+ABD+RAHMAN+BIN+MOHAMED
Ir. ABDUL MALEK BIN ABD AZIZ,https://www.google.com/search?q=Ir.+ABDUL+MALEK+BIN+ABD+AZIZ
Ir. ABDUL MALIK HUSSEIN BIN ABDUL JALIL,https://www.google.com/search?q=Ir.+ABDUL+MALIK+HUSSEIN+BIN+ABDUL+JALIL
Ir. ABDUL MUNIR BIN ABDUL KARIM,https://www.google.com/search?q=Ir.+ABDUL+MUNIR+BIN+ABDUL+KARIM
Ir. ABDUL NASSER BIN ABDUL WAHAB,https://www.google.com/search?q=Ir.+ABDUL+NASSER+BIN+ABDUL+WAHAB
Ir. ABDUL RAHIM BIN SIDEK,https://www.google.com/search?q=Ir.+ABDUL+RAHIM+BIN+SIDEK
Ir. ABDUL RAHMAN BIN ADAM,https://www.google.com/search?q=Ir.+ABDUL+RAHMAN+BIN+ADAM
Ir. ABDUL RAHMAN BIN HASHIM,https://www.google.com/search?q=Ir.+ABDUL+RAHMAN+BIN+HASHIM
Ir. ABDUL SHUKUR BIN AHYAT,https://www.google.com/search?q=Ir.+ABDUL+SHUKUR+BIN+AHYAT
Ir. ABDUL TALIB BIN LAZIM,https://www.google.com/search?q=Ir.+ABDUL+TALIB+BIN+LAZIM
Ir. ABDUL WAHAB BIN IKHSAN,https://www.google.com/search?q=Ir.+ABDUL+WAHAB+BIN+IKHSAN
Ir. ABDULDAN BIN ADTONG,https://www.google.com/search?q=Ir.+ABDULDAN+BIN+ADTONG
Ir. ABDULLAH BIN DIN SUHAIMI,https://www.google.com/search?q=Ir.+ABDULLAH+BIN+DIN+SUHAIMI
Ir. ABU BAKAR BIN MAHAT,https://www.google.com/search?q=Ir.+ABU+BAKAR+BIN+MAHAT
Ir. ABU BAKAR BIN MOHD NOOR (A),https://www.google.com/search?q=Ir.+ABU+BAKAR+BIN+MOHD+NOOR+(A)
Ir. ABU HASHIM BIN ABDUL RAHMAN,https://www.google.com/search?q=Ir.+ABU+HASHIM+BIN+ABDUL+RAHMAN
Ir. ACHUTHAN KUTTY A/L G KRISHNAN,https://www.google.com/search?q=Ir.+ACHUTHAN+KUTTY+A/L+G+KRISHNAN
Ir. ADAM BIN HJ GANI,https://www.google.com/search?q=Ir.+ADAM+BIN+HJ+GANI
Ir. ADNAN BIN MOHAMAD,https://www.google.com/search?q=Ir.+ADNAN+BIN+MOHAMAD
Ir. ADZNIR BIN MOKHTAR,https://www.google.com/search?q=Ir.+ADZNIR+BIN+MOKHTAR
Ir. AHMAD AFZAINIZAM BIN MOKHTAR,https://www.google.com/search?q=Ir.+AHMAD+AFZAINIZAM+BIN+MOKHTAR
Ir. AHMAD APANDI BIN LAKIN,https://www.google.com/search?q=Ir.+AHMAD+APANDI+BIN+LAKIN
Ir. AHMAD ASRI BIN ABDUL HAMID,https://www.google.com/search?q=Ir.+AHMAD+ASRI+BIN+ABDUL+HAMID
Ir. AHMAD BIN JAFAR @ JAAFAR,https://www.google.com/search?q=Ir.+AHMAD+BIN+JAFAR+@+JAAFAR
Ir. AHMAD FADZEL BIN MOHD MOKHTAR,https://www.google.com/search?q=Ir.+AHMAD+FADZEL+BIN+MOHD+MOKHTAR
Ir. AHMAD FADZLI BIN HASHIM,https://www.google.com/search?q=Ir.+AHMAD+FADZLI+BIN+HASHIM
Ir. AHMAD FAIZAL BIN AHMAD,https://www.google.com/search?q=Ir.+AHMAD+FAIZAL+BIN+AHMAD
Ir. AHMAD FAIZUL BIN SHAMSUDIN,https://www.google.com/search?q=Ir.+AHMAD+FAIZUL+BIN+SHAMSUDIN
Ir. AHMAD FARIS BIN MOHD SALLEH,https://www.google.com/search?q=Ir.+AHMAD+FARIS+BIN+MOHD+SALLEH
Ir. AHMAD FAUZI BIN HASAN,https://www.google.com/search?q=Ir.+AHMAD+FAUZI+BIN+HASAN
Ir. AHMAD HADRI BIN HARIS,https://www.google.com/search?q=Ir.+AHMAD+HADRI+BIN+HARIS
Ir. AHMAD HUSAIRI BIN HJ ABDULLAH,https://www.google.com/search?q=Ir.+AHMAD+HUSAIRI+BIN+HJ+ABDULLAH
Ir. AHMAD IZDIHAR BIN SUPAAT,https://www.google.com/search?q=Ir.+AHMAD+IZDIHAR+BIN+SUPAAT
Ir. AHMAD JAILANI BIN MANSOR,https://www.google.com/search?q=Ir.+AHMAD+JAILANI+BIN+MANSOR
Ir. AHMAD KAMARUZZAMAN B MOHD BAKI,https://www.google.com/search?q=Ir.+AHMAD+KAMARUZZAMAN+B+MOHD+BAKI
Ir. AHMAD KHAIRIRI BIN ABDUL GHANI,https://www.google.com/search?q=Ir.+AHMAD+KHAIRIRI+BIN+ABDUL+GHANI
Ir. AHMAD KHAIRUDDIN BIN AHMAD KAMAL,https://www.google.com/search?q=Ir.+AHMAD+KHAIRUDDIN+BIN+AHMAD+KAMAL
Ir. AHMAD LUTFI BIN SALIM,https://www.google.com/search?q=Ir.+AHMAD+LUTFI+BIN+SALIM
Ir. AHMAD MASYHUR BIN JAHAYA,https://www.google.com/search?q=Ir.+AHMAD+MASYHUR+BIN+JAHAYA
Ir. AHMAD MAZLI BIN HJ MAAROFF,https://www.google.com/search?q=Ir.+AHMAD+MAZLI+BIN+HJ+MAAROFF
Ir. AHMAD RAFIDI BIN MOHAYIDDIN,https://www.google.com/search?q=Ir.+AHMAD+RAFIDI+BIN+MOHAYIDDIN
Ir. AHMAD RAFIDI BIN MOHD DAUD,https://www.google.com/search?q=Ir.+AHMAD+RAFIDI+BIN+MOHD+DAUD
Ir. AHMAD RIDZAUDDIN BIN IBRAHIM,https://www.google.com/search?q=Ir.+AHMAD+RIDZAUDDIN+BIN+IBRAHIM
Ir. AHMAD RIDZUAN BIN BAHARUDIN,https://www.google.com/search?q=Ir.+AHMAD+RIDZUAN+BIN+BAHARUDIN
Ir. AHMAD SAZILI B HJ MOHAMED,https://www.google.com/search?q=Ir.+AHMAD+SAZILI+B+HJ+MOHAMED
Ir. AHMAD SHAHROM BIN MOHD YUNUS,https://www.google.com/search?q=Ir.+AHMAD+SHAHROM+BIN+MOHD+YUNUS
Ir. AHMAD TAJUDDIN BIN MOHAMED,https://www.google.com/search?q=Ir.+AHMAD+TAJUDDIN+BIN+MOHAMED
Ir. AHMAD ZAINNIE BIN ABU HASSAN,https://www.google.com/search?q=Ir.+AHMAD+ZAINNIE+BIN+ABU+HASSAN
Ir. AHMAD ZAWAWI BIN ABDULLAH,https://www.google.com/search?q=Ir.+AHMAD+ZAWAWI+BIN+ABDULLAH
Ir. AHMAD ZULHAIMI HAFEEZ BIN ZULKEFLI,https://www.google.com/search?q=Ir.+AHMAD+ZULHAIMI+HAFEEZ+BIN+ZULKEFLI
Ir. AIDID BIN CHEE TAHIR,https://www.google.com/search?q=Ir.+AIDID+BIN+CHEE+TAHIR
Ir. AISHAH HAZLINA BTE MD DEAN,https://www.google.com/search?q=Ir.+AISHAH+HAZLINA+BTE+MD+DEAN
Ir. AKASHAH BIN BASHAH,https://www.google.com/search?q=Ir.+AKASHAH+BIN+BASHAH
Ir. AL'AZMY BIN AHMAD,https://www.google.com/search?q=Ir.+AL'AZMY+BIN+AHMAD
Ir. AL-KHAIRI BIN MOHD DAUD,https://www.google.com/search?q=Ir.+AL-KHAIRI+BIN+MOHD+DAUD
Ir. ALBERT GOH CHEE KONG,https://www.google.com/search?q=Ir.+ALBERT+GOH+CHEE+KONG
Ir. ALEXON JONG SZE CHIEN,https://www.google.com/search?q=Ir.+ALEXON+JONG+SZE+CHIEN
Ir. ALI BIN RAHMAT,https://www.google.com/search?q=Ir.+ALI+BIN+RAHMAT
Ir. ALPHONSUS DORHAT BIN RAHANI,https://www.google.com/search?q=Ir.+ALPHONSUS+DORHAT+BIN+RAHANI
Ir. ALVIN LEE YEW WYN,https://www.google.com/search?q=Ir.+ALVIN+LEE+YEW+WYN
Ir. ALZAKRI BIN EKHWAN,https://www.google.com/search?q=Ir.+ALZAKRI+BIN+EKHWAN
Ir. AMAT YAZID BIN OTHMAN,https://www.google.com/search?q=Ir.+AMAT+YAZID+BIN+OTHMAN
Ir. AMER AQHARI BIN ABDUL NASIR,https://www.google.com/search?q=Ir.+AMER+AQHARI+BIN+ABDUL+NASIR
Ir. AMIN SHAHRIZ BIN YAZID,https://www.google.com/search?q=Ir.+AMIN+SHAHRIZ+BIN+YAZID
Ir. AMINUDDIN BIN MOHD YUSOFF,https://www.google.com/search?q=Ir.+AMINUDDIN+BIN+MOHD+YUSOFF
Ir. AMINUDIN BIN MOHD MASHURDIN,https://www.google.com/search?q=Ir.+AMINUDIN+BIN+MOHD+MASHURDIN
Ir. AMIR HAMZAH BIN JA'AFAR,https://www.google.com/search?q=Ir.+AMIR+HAMZAH+BIN+JA'AFAR
Ir. AMIR HASDI BIN FAUZI @ MAT RAWI,https://www.google.com/search?q=Ir.+AMIR+HASDI+BIN+FAUZI+@+MAT+RAWI
Ir. AMIR HISHAM BIN ABD RAHIM,https://www.google.com/search?q=Ir.+AMIR+HISHAM+BIN+ABD+RAHIM
Ir. AMIR RADZI BIN AB GHANI,https://www.google.com/search?q=Ir.+AMIR+RADZI+BIN+AB+GHANI
Ir. AMIR SOFFIAN BIN ABDUL RAZAK,https://www.google.com/search?q=Ir.+AMIR+SOFFIAN+BIN+ABDUL+RAZAK
Ir. AMIRRUDIN BIN ALI,https://www.google.com/search?q=Ir.+AMIRRUDIN+BIN+ALI
Ir. AMMERAN BIN MAD,https://www.google.com/search?q=Ir.+AMMERAN+BIN+MAD
Ir. ANA MIRAA BT MOHD YUSOF,https://www.google.com/search?q=Ir.+ANA+MIRAA+BT+MOHD+YUSOF
Ir. ANDREW S R AMALADOSS,https://www.google.com/search?q=Ir.+ANDREW+S+R+AMALADOSS
Ir. ANDY GOH CHIA LIANG,https://www.google.com/search?q=Ir.+ANDY+GOH+CHIA+LIANG
Ir. ANTHONY HUANG KIONG HUAT,https://www.google.com/search?q=Ir.+ANTHONY+HUANG+KIONG+HUAT
Ir. ANUAR BIN AB RANI,https://www.google.com/search?q=Ir.+ANUAR+BIN+AB+RANI
Ir. ANUAR BIN ABDULLAH,https://www.google.com/search?q=Ir.+ANUAR+BIN+ABDULLAH
Ir. ANUAR BIN MOHAMAD,https://www.google.com/search?q=Ir.+ANUAR+BIN+MOHAMAD
Ir. AQIL SIDDIQ BIN MUSTAPHA,https://www.google.com/search?q=Ir.+AQIL+SIDDIQ+BIN+MUSTAPHA
Ir. ARDY SUHAIDY BIN MUSTAPHA,https://www.google.com/search?q=Ir.+ARDY+SUHAIDY+BIN+MUSTAPHA
Ir. ARUL HISHAM BIN ABDUL RAHIM,https://www.google.com/search?q=Ir.+ARUL+HISHAM+BIN+ABDUL+RAHIM
Ir. ARULJOTHY S/O PAHAVAN,https://www.google.com/search?q=Ir.+ARULJOTHY+S/O+PAHAVAN
Ir. ARVIND VISWANATH MENON,https://www.google.com/search?q=Ir.+ARVIND+VISWANATH+MENON
Ir. ASHARI BIN EBRAHIM,https://www.google.com/search?q=Ir.+ASHARI+BIN+EBRAHIM
Ir. ASMADENA BINTI MD HALIMI,https://www.google.com/search?q=Ir.+ASMADENA+BINTI+MD+HALIMI
Ir. ASOK KUMAR S/O HARILAL HIRA,https://www.google.com/search?q=Ir.+ASOK+KUMAR+S/O+HARILAL+HIRA
Ir. ATHIRAH BT MUSTAMIR DT BANDHARO,https://www.google.com/search?q=Ir.+ATHIRAH+BT+MUSTAMIR+DT+BANDHARO
Ir. AU CHONG HUN,https://www.google.com/search?q=Ir.+AU+CHONG+HUN
Ir. AU WAI CHUN,https://www.google.com/search?q=Ir.+AU+WAI+CHUN
Ir. AU YEW FOO,https://www.google.com/search?q=Ir.+AU+YEW+FOO
Ir. AUSAMAH DARWISH BIN MOHD DAUD,https://www.google.com/search?q=Ir.+AUSAMAH+DARWISH+BIN+MOHD+DAUD
Ir. AWANG MUSTAPA PENGIRAN MAHARAN,https://www.google.com/search?q=Ir.+AWANG+MUSTAPA+PENGIRAN+MAHARAN
Ir. AWANG SALEH BIN MAKMUD,https://www.google.com/search?q=Ir.+AWANG+SALEH+BIN+MAKMUD
Ir. AZAHAR BIN ABDUL WAHAB,https://www.google.com/search?q=Ir.+AZAHAR+BIN+ABDUL+WAHAB
Ir. AZAHAR BIN AWALLUDIN,https://www.google.com/search?q=Ir.+AZAHAR+BIN+AWALLUDIN
Ir. AZAMI BIN AMAT,https://www.google.com/search?q=Ir.+AZAMI+BIN+AMAT
Ir. AZAMI BIN RAMLI,https://www.google.com/search?q=Ir.+AZAMI+BIN+RAMLI
Ir. AZAR BIN MOHD YASSIN,https://www.google.com/search?q=Ir.+AZAR+BIN+MOHD+YASSIN
Ir. AZHAN AB. RAHMAN,https://www.google.com/search?q=Ir.+AZHAN+AB.+RAHMAN
Ir. AZHAN BIN SALLEH,https://www.google.com/search?q=Ir.+AZHAN+BIN+SALLEH
Ir. AZHAR BIN ABU HADZIM,https://www.google.com/search?q=Ir.+AZHAR+BIN+ABU+HADZIM
Ir. AZIRAM BIN MAT SALLEH,https://www.google.com/search?q=Ir.+AZIRAM+BIN+MAT+SALLEH
Ir. AZIZAH BINTI KASSIM,https://www.google.com/search?q=Ir.+AZIZAH+BINTI+KASSIM
Ir. AZIZI BIN AHAMAD,https://www.google.com/search?q=Ir.+AZIZI+BIN+AHAMAD
Ir. AZIZS BIN SAFRI,https://www.google.com/search?q=Ir.+AZIZS+BIN+SAFRI
Ir. AZIZUL AZILY BIN AHMAD,https://www.google.com/search?q=Ir.+AZIZUL+AZILY+BIN+AHMAD
Ir. AZIZUL AZMI B. KAMARUL ZAMAN,https://www.google.com/search?q=Ir.+AZIZUL+AZMI+B.+KAMARUL+ZAMAN
Ir. AZIZUL AZUAN BIN SAHRUM,https://www.google.com/search?q=Ir.+AZIZUL+AZUAN+BIN+SAHRUM
Ir. AZMAN BIN ABDUL MAJID,https://www.google.com/search?q=Ir.+AZMAN+BIN+ABDUL+MAJID
Ir. AZMAN BIN BUJANG,https://www.google.com/search?q=Ir.+AZMAN+BIN+BUJANG
Ir. AZMAN BIN MD ISA,https://www.google.com/search?q=Ir.+AZMAN+BIN+MD+ISA
Ir. AZMAN BIN SAUBIRAN,https://www.google.com/search?q=Ir.+AZMAN+BIN+SAUBIRAN
Ir. AZMAN BIN SENIN,https://www.google.com/search?q=Ir.+AZMAN+BIN+SENIN
Ir. AZMAN SHAH BIN AHMAT,https://www.google.com/search?q=Ir.+AZMAN+SHAH+BIN+AHMAT
Ir. AZMER BIN SHAMSUDDIN,https://www.google.com/search?q=Ir.+AZMER+BIN+SHAMSUDDIN
Ir. AZMI BIN ABDUL JALIL,https://www.google.com/search?q=Ir.+AZMI+BIN+ABDUL+JALIL
Ir. AZMI BIN AHMAD,https://www.google.com/search?q=Ir.+AZMI+BIN+AHMAD
Ir. AZMI BIN AWI,https://www.google.com/search?q=Ir.+AZMI+BIN+AWI
Ir. AZMI BIN OSMAN,https://www.google.com/search?q=Ir.+AZMI+BIN+OSMAN
Ir. AZMI BIN SAAD,https://www.google.com/search?q=Ir.+AZMI+BIN+SAAD
Ir. AZMI BIN SULAIMAN,https://www.google.com/search?q=Ir.+AZMI+BIN+SULAIMAN
Ir. AZMI BIN TALIB,https://www.google.com/search?q=Ir.+AZMI+BIN+TALIB
Ir. AZMI MERICAN BIN MD ISMAIL MERICAN,https://www.google.com/search?q=Ir.+AZMI+MERICAN+BIN+MD+ISMAIL+MERICAN
Ir. AZMIR BIN MOHD ISA,https://www.google.com/search?q=Ir.+AZMIR+BIN+MOHD+ISA
Ir. AZNIDA BT MOHAMED RAZALI,https://www.google.com/search?q=Ir.+AZNIDA+BT+MOHAMED+RAZALI
Ir. BADLISHAH MAT ISA,https://www.google.com/search?q=Ir.+BADLISHAH+MAT+ISA
Ir. BAHROM BIN BAHARIN,https://www.google.com/search?q=Ir.+BAHROM+BIN+BAHARIN
Ir. BATUMALAY A/L KALIANNAN,https://www.google.com/search?q=Ir.+BATUMALAY+A/L+KALIANNAN
Ir. BEKTI LELANA BIN JITNO WIDODO,https://www.google.com/search?q=Ir.+BEKTI+LELANA+BIN+JITNO+WIDODO
Ir. BENJAMIN NG CHONG JIN,https://www.google.com/search?q=Ir.+BENJAMIN+NG+CHONG+JIN
Ir. BENNET APRIANTO BIN SOEGIARTO,https://www.google.com/search?q=Ir.+BENNET+APRIANTO+BIN+SOEGIARTO
Ir. BERNARD SAGAIYARAJ J SWAMIRAJU,https://www.google.com/search?q=Ir.+BERNARD+SAGAIYARAJ+J+SWAMIRAJU
Ir. BERNARD WONG SHUEN YUAN,https://www.google.com/search?q=Ir.+BERNARD+WONG+SHUEN+YUAN
Ir. BHASKAR A/L KANNAN,https://www.google.com/search?q=Ir.+BHASKAR+A/L+KANNAN
Ir. BOEY HOR MENG,https://www.google.com/search?q=Ir.+BOEY+HOR+MENG
Ir. BOEY WEI LUN,https://www.google.com/search?q=Ir.+BOEY+WEI+LUN
Ir. BONG NYUK POH FELIX,https://www.google.com/search?q=Ir.+BONG+NYUK+POH+FELIX
Ir. BRYAN NG HORNG HENG,https://www.google.com/search?q=Ir.+BRYAN+NG+HORNG+HENG
Ir. BURHANUD-DIN BIN HAJI ISHAK,https://www.google.com/search?q=Ir.+BURHANUD-DIN+BIN+HAJI+ISHAK
Ir. CALVIN CHIN YEN CHIH,https://www.google.com/search?q=Ir.+CALVIN+CHIN+YEN+CHIH
Ir. CHA HOONG KUM,https://www.google.com/search?q=Ir.+CHA+HOONG+KUM
Ir. CHAI BUI FUI,https://www.google.com/search?q=Ir.+CHAI+BUI+FUI
Ir. CHAI CHEN SING,https://www.google.com/search?q=Ir.+CHAI+CHEN+SING
Ir. CHAI VUN LUNG,https://www.google.com/search?q=Ir.+CHAI+VUN+LUNG
Ir. CHAI WEI SIAN,https://www.google.com/search?q=Ir.+CHAI+WEI+SIAN
Ir. CHAM KOK SOON,https://www.google.com/search?q=Ir.+CHAM+KOK+SOON
Ir. CHAN CHEE HONG,https://www.google.com/search?q=Ir.+CHAN+CHEE+HONG
Ir. CHAN CHEN MING,https://www.google.com/search?q=Ir.+CHAN+CHEN+MING
Ir. CHAN CHIN KEONG,https://www.google.com/search?q=Ir.+CHAN+CHIN+KEONG
Ir. CHAN KA SEONG,https://www.google.com/search?q=Ir.+CHAN+KA+SEONG
Ir. CHAN KAM CHYE,https://www.google.com/search?q=Ir.+CHAN+KAM+CHYE
Ir. CHAN KOK PENG @ WARRENCE CHAN,https://www.google.com/search?q=Ir.+CHAN+KOK+PENG+@+WARRENCE+CHAN
Ir. CHAN KON HENG,https://www.google.com/search?q=Ir.+CHAN+KON+HENG
Ir. CHAN MAN YIK,https://www.google.com/search?q=Ir.+CHAN+MAN+YIK
Ir. CHAN SWEE CHOONG,https://www.google.com/search?q=Ir.+CHAN+SWEE+CHOONG
Ir. CHAN WAH CHEONG,https://www.google.com/search?q=Ir.+CHAN+WAH+CHEONG
Ir. CHAN WENG LOON,https://www.google.com/search?q=Ir.+CHAN+WENG+LOON
Ir. CHAN YING WAI,https://www.google.com/search?q=Ir.+CHAN+YING+WAI
Ir. CHANG CHEANG HONG,https://www.google.com/search?q=Ir.+CHANG+CHEANG+HONG
Ir. CHANG HENG YONG,https://www.google.com/search?q=Ir.+CHANG+HENG+YONG
Ir. CHANG KWONG YUE,https://www.google.com/search?q=Ir.+CHANG+KWONG+YUE
Ir. CHANG YI LEE IGNATIUS,https://www.google.com/search?q=Ir.+CHANG+YI+LEE+IGNATIUS
Ir. CHANG YIT WAH,https://www.google.com/search?q=Ir.+CHANG+YIT+WAH
Ir. CHARLES SELVAM ANDREW,https://www.google.com/search?q=Ir.+CHARLES+SELVAM+ANDREW
Ir. CHE ENGKU KHALID BIN CHE ENGKU HJ MAT,https://www.google.com/search?q=Ir.+CHE+ENGKU+KHALID+BIN+CHE+ENGKU+HJ+MAT
Ir. CHE WAN MOHD ZAIRUDIN BIN CHE WAN HUSAIN,https://www.google.com/search?q=Ir.+CHE+WAN+MOHD+ZAIRUDIN+BIN+CHE+WAN+HUSAIN
Ir. CHE ZULKIFLI BIN CHE ISMAIL,https://www.google.com/search?q=Ir.+CHE+ZULKIFLI+BIN+CHE+ISMAIL
Ir. CHEA THEAN TEIK,https://www.google.com/search?q=Ir.+CHEA+THEAN+TEIK
Ir. CHEAH HUI CHENG,https://www.google.com/search?q=Ir.+CHEAH+HUI+CHENG
Ir. CHEAH KHOR MOOK,https://www.google.com/search?q=Ir.+CHEAH+KHOR+MOOK
Ir. CHEAH SONG HOCK,https://www.google.com/search?q=Ir.+CHEAH+SONG+HOCK
Ir. CHEANG SEIT KEONG,https://www.google.com/search?q=Ir.+CHEANG+SEIT+KEONG
Ir. CHEE CHECK KEEN,https://www.google.com/search?q=Ir.+CHEE+CHECK+KEEN
Ir. CHEE FOON POY,https://www.google.com/search?q=Ir.+CHEE+FOON+POY
Ir. CHEE FOONG SENG,https://www.google.com/search?q=Ir.+CHEE+FOONG+SENG
Ir. CHEE KAR MING,https://www.google.com/search?q=Ir.+CHEE+KAR+MING
Ir. CHEE TECK HEE,https://www.google.com/search?q=Ir.+CHEE+TECK+HEE
Ir. CHEE YEW JIN,https://www.google.com/search?q=Ir.+CHEE+YEW+JIN
Ir. CHEK WAN SAMSUDIN B CHE WAN AHMAD,https://www.google.com/search?q=Ir.+CHEK+WAN+SAMSUDIN+B+CHE+WAN+AHMAD
Ir. CHEN FUN CHIEN,https://www.google.com/search?q=Ir.+CHEN+FUN+CHIEN
Ir. CHEN KENG HING LAWRENCE,https://www.google.com/search?q=Ir.+CHEN+KENG+HING+LAWRENCE
Ir. CHEN KIN SEONG,https://www.google.com/search?q=Ir.+CHEN+KIN+SEONG
Ir. CHEN SHAW JYE,https://www.google.com/search?q=Ir.+CHEN+SHAW+JYE
Ir. CHEN THIAM LEONG,https://www.google.com/search?q=Ir.+CHEN+THIAM+LEONG
Ir. CHENG CHEW KONG,https://www.google.com/search?q=Ir.+CHENG+CHEW+KONG
Ir. CHENG KEE HAUT,https://www.google.com/search?q=Ir.+CHENG+KEE+HAUT
Ir. CHENG YEW LEONG,https://www.google.com/search?q=Ir.+CHENG+YEW+LEONG
Ir. CHEO MIANG CHEH @ MIANG POO,https://www.google.com/search?q=Ir.+CHEO+MIANG+CHEH+@+MIANG+POO
Ir. CHEOK GID WONG,https://www.google.com/search?q=Ir.+CHEOK+GID+WONG
Ir. CHEONG CHEE MING,https://www.google.com/search?q=Ir.+CHEONG+CHEE+MING
Ir. CHEONG CHI FUONG,https://www.google.com/search?q=Ir.+CHEONG+CHI+FUONG
Ir. CHEONG JONG PEOW,https://www.google.com/search?q=Ir.+CHEONG+JONG+PEOW
Ir. CHEONG KAM CHOON,https://www.google.com/search?q=Ir.+CHEONG+KAM+CHOON
Ir. CHEONG KWOK WAH,https://www.google.com/search?q=Ir.+CHEONG+KWOK+WAH
Ir. CHEONG THIAM FOOK,https://www.google.com/search?q=Ir.+CHEONG+THIAM+FOOK
Ir. CHEONG VAI YAN,https://www.google.com/search?q=Ir.+CHEONG+VAI+YAN
Ir. CHEONG YOON KWAN,https://www.google.com/search?q=Ir.+CHEONG+YOON+KWAN
Ir. CHEW HAN NIE,https://www.google.com/search?q=Ir.+CHEW+HAN+NIE
Ir. CHEW HOONG YEW,https://www.google.com/search?q=Ir.+CHEW+HOONG+YEW
Ir. CHEW HUAT CHIANG,https://www.google.com/search?q=Ir.+CHEW+HUAT+CHIANG
Ir. CHEW PHAI CHENG,https://www.google.com/search?q=Ir.+CHEW+PHAI+CHENG
Ir. CHEW TZE SEANG,https://www.google.com/search?q=Ir.+CHEW+TZE+SEANG
Ir. CHIA KHUIN FUNG,https://www.google.com/search?q=Ir.+CHIA+KHUIN+FUNG
Ir. CHIA SOON YOON,https://www.google.com/search?q=Ir.+CHIA+SOON+YOON
Ir. CHIA SUN MENG,https://www.google.com/search?q=Ir.+CHIA+SUN+MENG
Ir. CHIA SWEE PENG,https://www.google.com/search?q=Ir.+CHIA+SWEE+PENG
Ir. CHIAM YAK MENG,https://www.google.com/search?q=Ir.+CHIAM+YAK+MENG
Ir. CHIANG KONG YEW,https://www.google.com/search?q=Ir.+CHIANG+KONG+YEW
Ir. CHIENG LEE HUI,https://www.google.com/search?q=Ir.+CHIENG+LEE+HUI
Ir. CHIN CHEE LEONG,https://www.google.com/search?q=Ir.+CHIN+CHEE+LEONG
Ir. CHIN CHEE SEONG,https://www.google.com/search?q=Ir.+CHIN+CHEE+SEONG
Ir. CHIN HOOI PUNG,https://www.google.com/search?q=Ir.+CHIN+HOOI+PUNG
Ir. CHIN HUI SENG,https://www.google.com/search?q=Ir.+CHIN+HUI+SENG
Ir. CHIN KAI SHOONG,https://www.google.com/search?q=Ir.+CHIN+KAI+SHOONG
Ir. CHIN KHIN FATT,https://www.google.com/search?q=Ir.+CHIN+KHIN+FATT
Ir. CHIN SEE WENG,https://www.google.com/search?q=Ir.+CHIN+SEE+WENG
Ir. CHIN SHYI HER,https://www.google.com/search?q=Ir.+CHIN+SHYI+HER
Ir. CHIN SZE YUAN,https://www.google.com/search?q=Ir.+CHIN+SZE+YUAN
Ir. CHIN TECK ENG,https://www.google.com/search?q=Ir.+CHIN+TECK+ENG
Ir. CHIN YIT KHUAN,https://www.google.com/search?q=Ir.+CHIN+YIT+KHUAN
Ir. CHIN YOON WEI,https://www.google.com/search?q=Ir.+CHIN+YOON+WEI
Ir. CHING CHEE KENG,https://www.google.com/search?q=Ir.+CHING+CHEE+KENG
Ir. CHING LI SHEN,https://www.google.com/search?q=Ir.+CHING+LI+SHEN
Ir. CHOK YIN THONG,https://www.google.com/search?q=Ir.+CHOK+YIN+THONG
Ir. CHOK YUN VUN,https://www.google.com/search?q=Ir.+CHOK+YUN+VUN
Ir. CHONG CHE SIANG,https://www.google.com/search?q=Ir.+CHONG+CHE+SIANG
Ir. CHONG CHEE SHANG,https://www.google.com/search?q=Ir.+CHONG+CHEE+SHANG
Ir. CHONG CHEE YONG,https://www.google.com/search?q=Ir.+CHONG+CHEE+YONG
Ir. CHONG CHIEN FATT,https://www.google.com/search?q=Ir.+CHONG+CHIEN+FATT
Ir. CHONG CHIN CHOI,https://www.google.com/search?q=Ir.+CHONG+CHIN+CHOI
Ir. CHONG CHUNG YEE,https://www.google.com/search?q=Ir.+CHONG+CHUNG+YEE
Ir. CHONG KAI LOK,https://www.google.com/search?q=Ir.+CHONG+KAI+LOK
Ir. CHONG KIAN WEI,https://www.google.com/search?q=Ir.+CHONG+KIAN+WEI
Ir. CHONG KOK HUA,https://www.google.com/search?q=Ir.+CHONG+KOK+HUA
Ir. CHONG LEH KHENG,https://www.google.com/search?q=Ir.+CHONG+LEH+KHENG
Ir. CHONG LIAN CHING,https://www.google.com/search?q=Ir.+CHONG+LIAN+CHING
Ir. CHONG LIN HIONG @ CHONG LING HEONG,https://www.google.com/search?q=Ir.+CHONG+LIN+HIONG+@+CHONG+LING+HEONG
Ir. CHONG PEN KWONG,https://www.google.com/search?q=Ir.+CHONG+PEN+KWONG
Ir. CHONG SHAH LEONG,https://www.google.com/search?q=Ir.+CHONG+SHAH+LEONG
Ir. CHONG TJUN YIE,https://www.google.com/search?q=Ir.+CHONG+TJUN+YIE
Ir. CHONG WOEI TDING,https://www.google.com/search?q=Ir.+CHONG+WOEI+TDING
Ir. CHONG XIN XI,https://www.google.com/search?q=Ir.+CHONG+XIN+XI
Ir. CHOO LAY GUAT,https://www.google.com/search?q=Ir.+CHOO+LAY+GUAT
Ir. CHOONG CHUN WAI,https://www.google.com/search?q=Ir.+CHOONG+CHUN+WAI
Ir. CHOOT TECK AUN,https://www.google.com/search?q=Ir.+CHOOT+TECK+AUN
Ir. CHOW CHEE CHOY,https://www.google.com/search?q=Ir.+CHOW+CHEE+CHOY
Ir. CHOW CHIN SEANG,https://www.google.com/search?q=Ir.+CHOW+CHIN+SEANG
Ir. CHOW HOE SENG,https://www.google.com/search?q=Ir.+CHOW+HOE+SENG
