Name_name,Google Link Redirect
Ir. CHOW KAM YEEN,https://www.google.com/search?q=Ir.+CHOW+KAM+YEEN
Ir. CHOW SEI YING,https://www.google.com/search?q=Ir.+CHOW+SEI+YING
Ir. CHOW WOON CHEK,https://www.google.com/search?q=Ir.+CHOW+WOON+CHEK
Ir. CHRYS JONATHAN PHILIPPINUS,https://www.google.com/search?q=Ir.+CHRYS+JONATHAN+PHILIPPINUS
Ir. CHU CHUN YIT,https://www.google.com/search?q=Ir.+CHU+CHUN+YIT
Ir. CHU HON FEI,https://www.google.com/search?q=Ir.+CHU+HON+FEI
Ir. CHU PAK ENG,https://www.google.com/search?q=Ir.+CHU+PAK+ENG
Ir. CHUA CHEONG YU,https://www.google.com/search?q=Ir.+CHUA+CHEONG+YU
Ir. CHUA CHIN CHYANG,https://www.google.com/search?q=Ir.+CHUA+CHIN+CHYANG
Ir. CHUA WEI GHEE,https://www.google.com/search?q=Ir.+CHUA+WEI+GHEE
Ir. CHUA WEI PING,https://www.google.com/search?q=Ir.+CHUA+WEI+PING
Ir. CHUAH CHIN SENG,https://www.google.com/search?q=Ir.+CHUAH+CHIN+SENG
Ir. CHUNG FEE SIN @ CHANG SWI SEN,https://www.google.com/search?q=Ir.+CHUNG+FEE+SIN+@+CHANG+SWI+SEN
Ir. CHUNG YEE YONG,https://www.google.com/search?q=Ir.+CHUNG+YEE+YONG
Ir. CHWA KIM GUAN,https://www.google.com/search?q=Ir.+CHWA+KIM+GUAN
Ir. DANARAJ A/L CHANDRASEGARAN,https://www.google.com/search?q=Ir.+DANARAJ+A/L+CHANDRASEGARAN
Ir. DESMOND YEO PHOI YEW,https://www.google.com/search?q=Ir.+DESMOND+YEO+PHOI+YEW
Ir. DEVAN A/L IYAVOO,https://www.google.com/search?q=Ir.+DEVAN+A/L+IYAVOO
Ir. DEVANDRAN A/L P. NAGAIAH,https://www.google.com/search?q=Ir.+DEVANDRAN+A/L+P.+NAGAIAH
Ir. DHARMENDARAN DAYANANTHAN,https://www.google.com/search?q=Ir.+DHARMENDARAN+DAYANANTHAN
Ir. DIANA BINTI MOHD YASIN,https://www.google.com/search?q=Ir.+DIANA+BINTI+MOHD+YASIN
Ir. DINESH KUMAR A/L K PARAMESWARAN,https://www.google.com/search?q=Ir.+DINESH+KUMAR+A/L+K+PARAMESWARAN
Ir. DING JU LIANG,https://www.google.com/search?q=Ir.+DING+JU+LIANG
Ir. DOMINIC BECHAT ANAK NANANG,https://www.google.com/search?q=Ir.+DOMINIC+BECHAT+ANAK+NANANG
Ir. DOW MUN WAH,https://www.google.com/search?q=Ir.+DOW+MUN+WAH
Ir. Dr. ABDUL AZIM BIN ABDUL RAHMAN,https://www.google.com/search?q=Ir.+Dr.+ABDUL+AZIM+BIN+ABDUL+RAHMAN
Ir. Dr. ABDUL AZIZ BIN HASSAN,https://www.google.com/search?q=Ir.+Dr.+ABDUL+AZIZ+BIN+HASSAN
Ir. Dr. ABDUL MALIK BIN ZAINAL ABIDIN,https://www.google.com/search?q=Ir.+Dr.+ABDUL+MALIK+BIN+ZAINAL+ABIDIN
Ir. Dr. ABDUL MURAD BIN ZAINAL ABIDIN,https://www.google.com/search?q=Ir.+Dr.+ABDUL+MURAD+BIN+ZAINAL+ABIDIN
Ir. Dr. ABDUS SAMAD BIN MAHMUD,https://www.google.com/search?q=Ir.+Dr.+ABDUS+SAMAD+BIN+MAHMUD
Ir. Dr. AIDIL BIN CHEE TAHIR,https://www.google.com/search?q=Ir.+Dr.+AIDIL+BIN+CHEE+TAHIR
Ir. Dr. AKHTAR RAZUL BIN RAZALI,https://www.google.com/search?q=Ir.+Dr.+AKHTAR+RAZUL+BIN+RAZALI
Ir. Dr. ANDREW RAGAI HENRY RIGIT,https://www.google.com/search?q=Ir.+Dr.+ANDREW+RAGAI+HENRY+RIGIT
Ir. Dr. ARMAN BIN ARIFFIN,https://www.google.com/search?q=Ir.+Dr.+ARMAN+BIN+ARIFFIN
Ir. Dr. AZMI BIN MOHAMMED NOR,https://www.google.com/search?q=Ir.+Dr.+AZMI+BIN+MOHAMMED+NOR
Ir. Dr. BALAMURUGAN ANNAMALAI GURUNATHAN,https://www.google.com/search?q=Ir.+Dr.+BALAMURUGAN+ANNAMALAI+GURUNATHAN
Ir. Dr. CHIN NYOK KIEN,https://www.google.com/search?q=Ir.+Dr.+CHIN+NYOK+KIEN
Ir. Dr. CHOK LIAN FATT,https://www.google.com/search?q=Ir.+Dr.+CHOK+LIAN+FATT
Ir. Dr. FAIZAL BIN MUSTAPHA,https://www.google.com/search?q=Ir.+Dr.+FAIZAL+BIN+MUSTAPHA
Ir. Dr. FARID NASIR BIN ANI,https://www.google.com/search?q=Ir.+Dr.+FARID+NASIR+BIN+ANI
Ir. Dr. GANEINDRAN S/O SINNATHAMBY,https://www.google.com/search?q=Ir.+Dr.+GANEINDRAN+S/O+SINNATHAMBY
Ir. Dr. HAMDAN BIN HJ YA,https://www.google.com/search?q=Ir.+Dr.+HAMDAN+BIN+HJ+YA
Ir. Dr. HAZHA BIN ABDUL HAMID,https://www.google.com/search?q=Ir.+Dr.+HAZHA+BIN+ABDUL+HAMID
Ir. Dr. ISTAS FAHRURRAZI BIN NUSYIRWAN,https://www.google.com/search?q=Ir.+Dr.+ISTAS+FAHRURRAZI+BIN+NUSYIRWAN
Ir. Dr. JAWAID IQBAL INAYAT HUSSAIN,https://www.google.com/search?q=Ir.+Dr.+JAWAID+IQBAL+INAYAT+HUSSAIN
Ir. Dr. JAYASEELAN A/L NADARAJAH,https://www.google.com/search?q=Ir.+Dr.+JAYASEELAN+A/L+NADARAJAH
Ir. Dr. KHAIRUL NIZAM BIN MD TOHIT,https://www.google.com/search?q=Ir.+Dr.+KHAIRUL+NIZAM+BIN+MD+TOHIT
Ir. Dr. KHAIRUL SALLEH BIN MOHAMED SAHARI,https://www.google.com/search?q=Ir.+Dr.+KHAIRUL+SALLEH+BIN+MOHAMED+SAHARI
Ir. Dr. KRISHNA MORGAN A/L BALASUBRAMANIAM,https://www.google.com/search?q=Ir.+Dr.+KRISHNA+MORGAN+A/L+BALASUBRAMANIAM
Ir. Dr. KUMARAN PALANISAMY,https://www.google.com/search?q=Ir.+Dr.+KUMARAN+PALANISAMY
Ir. Dr. KWONG QI JIE,https://www.google.com/search?q=Ir.+Dr.+KWONG+QI+JIE
Ir. Dr. LAU CHONG CHUAN,https://www.google.com/search?q=Ir.+Dr.+LAU+CHONG+CHUAN
Ir. Dr. LIEW KUO FUNG,https://www.google.com/search?q=Ir.+Dr.+LIEW+KUO+FUNG
Ir. Dr. LIM CHYE ING,https://www.google.com/search?q=Ir.+Dr.+LIM+CHYE+ING
Ir. Dr. LIM MENG HEE,https://www.google.com/search?q=Ir.+Dr.+LIM+MENG+HEE
Ir. Dr. LING CHIN POH,https://www.google.com/search?q=Ir.+Dr.+LING+CHIN+POH
Ir. Dr. MOHAMAD ADZIZULROHIM BIN ABD MALEK,https://www.google.com/search?q=Ir.+Dr.+MOHAMAD+ADZIZULROHIM+BIN+ABD+MALEK
Ir. Dr. MOHAMAD HAMZI BIN MOHAMAD,https://www.google.com/search?q=Ir.+Dr.+MOHAMAD+HAMZI+BIN+MOHAMAD
Ir. Dr. MOHAMED AZLY BIN ABDUL AZIZ,https://www.google.com/search?q=Ir.+Dr.+MOHAMED+AZLY+BIN+ABDUL+AZIZ
Ir. Dr. MOHAMMAD SHAHRIL BIN OSMAN,https://www.google.com/search?q=Ir.+Dr.+MOHAMMAD+SHAHRIL+BIN+OSMAN
Ir. Dr. MOHD AMIN BIN ABD MAJID,https://www.google.com/search?q=Ir.+Dr.+MOHD+AMIN+BIN+ABD+MAJID
Ir. Dr. MOHD FAIRUSHAM BIN GHAZALI,https://www.google.com/search?q=Ir.+Dr.+MOHD+FAIRUSHAM+BIN+GHAZALI
Ir. Dr. MOHD FAIRUZ BIN AB RAHMAN,https://www.google.com/search?q=Ir.+Dr.+MOHD+FAIRUZ+BIN+AB+RAHMAN
Ir. Dr. MOHD SABRI BIN CHE JAMIL,https://www.google.com/search?q=Ir.+Dr.+MOHD+SABRI+BIN+CHE+JAMIL
Ir. Dr. MOHD SHUKRI BIN YOB,https://www.google.com/search?q=Ir.+Dr.+MOHD+SHUKRI+BIN+YOB
Ir. Dr. MOKHTAR AWANG,https://www.google.com/search?q=Ir.+Dr.+MOKHTAR+AWANG
Ir. Dr. MOKHTAR BIN CHE ISMAIL,https://www.google.com/search?q=Ir.+Dr.+MOKHTAR+BIN+CHE+ISMAIL
Ir. Dr. MUHAMMAD AZMI BIN AYUB,https://www.google.com/search?q=Ir.+Dr.+MUHAMMAD+AZMI+BIN+AYUB
Ir. Dr. MUI KAI YIN,https://www.google.com/search?q=Ir.+Dr.+MUI+KAI+YIN
Ir. Dr. NAGUR AZIZ BIN KAMAR BASHAH,https://www.google.com/search?q=Ir.+Dr.+NAGUR+AZIZ+BIN+KAMAR+BASHAH
Ir. Dr. NAVIN A/L RAMASAMY,https://www.google.com/search?q=Ir.+Dr.+NAVIN+A/L+RAMASAMY
Ir. Dr. NAWAL ASWAN BIN ABDUL JALIL,https://www.google.com/search?q=Ir.+Dr.+NAWAL+ASWAN+BIN+ABDUL+JALIL
Ir. Dr. NOR AZIZI BIN MAZALAN,https://www.google.com/search?q=Ir.+Dr.+NOR+AZIZI+BIN+MAZALAN
Ir. Dr. NORIAH BINTI YUSOFF,https://www.google.com/search?q=Ir.+Dr.+NORIAH+BINTI+YUSOFF
Ir. Dr. NORSHAH HAFEEZ BIN SHUAIB,https://www.google.com/search?q=Ir.+Dr.+NORSHAH+HAFEEZ+BIN+SHUAIB
Ir. Dr. OH SEONG POR,https://www.google.com/search?q=Ir.+Dr.+OH+SEONG+POR
Ir. Dr. RAJAKUMAR A/L A GOPAL,https://www.google.com/search?q=Ir.+Dr.+RAJAKUMAR+A/L+A+GOPAL
Ir. Dr. RAZALI BIN ABIDIN,https://www.google.com/search?q=Ir.+Dr.+RAZALI+BIN+ABIDIN
Ir. Dr. RIZAUDDIN BIN RAMLI,https://www.google.com/search?q=Ir.+Dr.+RIZAUDDIN+BIN+RAMLI
Ir. Dr. SAMAD BIN SOLBAI,https://www.google.com/search?q=Ir.+Dr.+SAMAD+BIN+SOLBAI
Ir. Dr. SAMSUL BAHRIN BIN OSMAN,https://www.google.com/search?q=Ir.+Dr.+SAMSUL+BAHRIN+BIN+OSMAN
Ir. Dr. SATESH NARAYANA NAMASIVAYAM,https://www.google.com/search?q=Ir.+Dr.+SATESH+NARAYANA+NAMASIVAYAM
Ir. Dr. SHAHARIN ANWAR BIN SULAIMAN,https://www.google.com/search?q=Ir.+Dr.+SHAHARIN+ANWAR+BIN+SULAIMAN
Ir. Dr. SHAMSUL AKMAR BIN AB AZIZ,https://www.google.com/search?q=Ir.+Dr.+SHAMSUL+AKMAR+BIN+AB+AZIZ
Ir. Dr. SII HOW SING,https://www.google.com/search?q=Ir.+Dr.+SII+HOW+SING
Ir. Dr. SUHAIMI BIN HASSAN,https://www.google.com/search?q=Ir.+Dr.+SUHAIMI+BIN+HASSAN
Ir. Dr. TAN CHEE FAI,https://www.google.com/search?q=Ir.+Dr.+TAN+CHEE+FAI
Ir. Dr. TAN LOON CHOOI,https://www.google.com/search?q=Ir.+Dr.+TAN+LOON+CHOOI
Ir. Dr. TEO HIU HONG,https://www.google.com/search?q=Ir.+Dr.+TEO+HIU+HONG
Ir. Dr. TUAN SUHAIMI BIN SALLEH,https://www.google.com/search?q=Ir.+Dr.+TUAN+SUHAIMI+BIN+SALLEH
Ir. Dr. ZAINAL FITRI BIN ZAINAL ABIDIN,https://www.google.com/search?q=Ir.+Dr.+ZAINAL+FITRI+BIN+ZAINAL+ABIDIN
Ir. Dr. ZAINUL ASRI BIN MAMAT,https://www.google.com/search?q=Ir.+Dr.+ZAINUL+ASRI+BIN+MAMAT
Ir. Dr. ZAMBRI HARUN,https://www.google.com/search?q=Ir.+Dr.+ZAMBRI+HARUN
Ir. Dr. ZAMRI BIN MOHAMED,https://www.google.com/search?q=Ir.+Dr.+ZAMRI+BIN+MOHAMED
Ir. DZAINUL BIN KHALID,https://www.google.com/search?q=Ir.+DZAINUL+BIN+KHALID
Ir. DZUL FAHMI BIN MD NORDIN,https://www.google.com/search?q=Ir.+DZUL+FAHMI+BIN+MD+NORDIN
Ir. DZULAIDIN TASRIN BIN OTHMAN,https://www.google.com/search?q=Ir.+DZULAIDIN+TASRIN+BIN+OTHMAN
Ir. EDAYU BT ABDULLAH,https://www.google.com/search?q=Ir.+EDAYU+BT+ABDULLAH
Ir. EDDY AK AHJU,https://www.google.com/search?q=Ir.+EDDY+AK+AHJU
Ir. EDGAR ANDREW WONG KOK CHEUN,https://www.google.com/search?q=Ir.+EDGAR+ANDREW+WONG+KOK+CHEUN
Ir. EDWARD LIM SZE YUAN,https://www.google.com/search?q=Ir.+EDWARD+LIM+SZE+YUAN
Ir. EDWIN SABINUS,https://www.google.com/search?q=Ir.+EDWIN+SABINUS
Ir. EE TECK CHEE,https://www.google.com/search?q=Ir.+EE+TECK+CHEE
Ir. ELMEIZAL JAMALUDIN,https://www.google.com/search?q=Ir.+ELMEIZAL+JAMALUDIN
Ir. EMI HAFIZZUL BIN JAMALUDDIN,https://www.google.com/search?q=Ir.+EMI+HAFIZZUL+BIN+JAMALUDDIN
Ir. ENG AH BA,https://www.google.com/search?q=Ir.+ENG+AH+BA
Ir. ENG TE WEI @ DAVID ENG,https://www.google.com/search?q=Ir.+ENG+TE+WEI+@+DAVID+ENG
Ir. ENG YONG KHENG,https://www.google.com/search?q=Ir.+ENG+YONG+KHENG
Ir. ENG YONG TEIK,https://www.google.com/search?q=Ir.+ENG+YONG+TEIK
Ir. ERIC SOH CHENG SIM,https://www.google.com/search?q=Ir.+ERIC+SOH+CHENG+SIM
Ir. ESMA NIZA BIN NAWI,https://www.google.com/search?q=Ir.+ESMA+NIZA+BIN+NAWI
Ir. EZRAL BIN ABDULLAH,https://www.google.com/search?q=Ir.+EZRAL+BIN+ABDULLAH
Ir. EZWAN BIN MOKHTAR,https://www.google.com/search?q=Ir.+EZWAN+BIN+MOKHTAR
Ir. EZZARHAN BIN ABDULLAH,https://www.google.com/search?q=Ir.+EZZARHAN+BIN+ABDULLAH
Ir. FADELI BIN ABDULLAH,https://www.google.com/search?q=Ir.+FADELI+BIN+ABDULLAH
Ir. FADIL BIN IBRAHIM,https://www.google.com/search?q=Ir.+FADIL+BIN+IBRAHIM
Ir. FADZLI BIN BURHANUDDIN,https://www.google.com/search?q=Ir.+FADZLI+BIN+BURHANUDDIN
Ir. FAIT BIN HANAPI,https://www.google.com/search?q=Ir.+FAIT+BIN+HANAPI
Ir. FAIZUL AZLY BIN ABD DZUBIR,https://www.google.com/search?q=Ir.+FAIZUL+AZLY+BIN+ABD+DZUBIR
Ir. FAM YEW HIN,https://www.google.com/search?q=Ir.+FAM+YEW+HIN
Ir. FAN CHUN YUEN,https://www.google.com/search?q=Ir.+FAN+CHUN+YUEN
Ir. FANG WAI HONG,https://www.google.com/search?q=Ir.+FANG+WAI+HONG
Ir. FATHULLAH RAZZAQ BIN GHAZALI,https://www.google.com/search?q=Ir.+FATHULLAH+RAZZAQ+BIN+GHAZALI
Ir. FITHRY BIN MOHD AMIR,https://www.google.com/search?q=Ir.+FITHRY+BIN+MOHD+AMIR
Ir. FONG WING HAN,https://www.google.com/search?q=Ir.+FONG+WING+HAN
Ir. FONG WING HONG,https://www.google.com/search?q=Ir.+FONG+WING+HONG
Ir. FOO KAI JAAN,https://www.google.com/search?q=Ir.+FOO+KAI+JAAN
Ir. FOO KHEN CHUNG,https://www.google.com/search?q=Ir.+FOO+KHEN+CHUNG
Ir. FOO KOK SENG,https://www.google.com/search?q=Ir.+FOO+KOK+SENG
Ir. FOO MING CHIU,https://www.google.com/search?q=Ir.+FOO+MING+CHIU
Ir. FOO SAI SENG,https://www.google.com/search?q=Ir.+FOO+SAI+SENG
Ir. FOONG CHEE WAI,https://www.google.com/search?q=Ir.+FOONG+CHEE+WAI
Ir. FOONG KOK HONG,https://www.google.com/search?q=Ir.+FOONG+KOK+HONG
Ir. FOONG MENG KHUM,https://www.google.com/search?q=Ir.+FOONG+MENG+KHUM
Ir. FOONG POH HING,https://www.google.com/search?q=Ir.+FOONG+POH+HING
Ir. FRANCIS BASIL PETER,https://www.google.com/search?q=Ir.+FRANCIS+BASIL+PETER
Ir. FUAD BIN ABAS,https://www.google.com/search?q=Ir.+FUAD+BIN+ABAS
Ir. FUAD NOR BIN JAPAR,https://www.google.com/search?q=Ir.+FUAD+NOR+BIN+JAPAR
Ir. G VENGADESAN A/L KS GOVINDARAJALU,https://www.google.com/search?q=Ir.+G+VENGADESAN+A/L+KS+GOVINDARAJALU
Ir. GAN CHOON HOCK,https://www.google.com/search?q=Ir.+GAN+CHOON+HOCK
Ir. GAN CHUN CHET,https://www.google.com/search?q=Ir.+GAN+CHUN+CHET
Ir. GAN KIN CHOON,https://www.google.com/search?q=Ir.+GAN+KIN+CHOON
Ir. GAN SOON KAI,https://www.google.com/search?q=Ir.+GAN+SOON+KAI
Ir. GERALD LIM CHIN SIONG,https://www.google.com/search?q=Ir.+GERALD+LIM+CHIN+SIONG
Ir. GHAZALI BIN IBRAHIM,https://www.google.com/search?q=Ir.+GHAZALI+BIN+IBRAHIM
Ir. GHAZARI BIN BAHAROM,https://www.google.com/search?q=Ir.+GHAZARI+BIN+BAHAROM
Ir. GOH CHII YEW,https://www.google.com/search?q=Ir.+GOH+CHII+YEW
Ir. GOH CHUN SHIAN,https://www.google.com/search?q=Ir.+GOH+CHUN+SHIAN
Ir. GOH KHENG WEE,https://www.google.com/search?q=Ir.+GOH+KHENG+WEE
Ir. GOH SU KIN,https://www.google.com/search?q=Ir.+GOH+SU+KIN
Ir. GOH WU TIEW,https://www.google.com/search?q=Ir.+GOH+WU+TIEW
Ir. GOH YUEN PHANG,https://www.google.com/search?q=Ir.+GOH+YUEN+PHANG
Ir. GOPAL A/L NARIAN KUTTY,https://www.google.com/search?q=Ir.+GOPAL+A/L+NARIAN+KUTTY
Ir. GOR KOK ENG,https://www.google.com/search?q=Ir.+GOR+KOK+ENG
Ir. H'NG CHIN YEONG,https://www.google.com/search?q=Ir.+H'NG+CHIN+YEONG
Ir. HAIRUL ANUAR BIN MOHD TAHIR,https://www.google.com/search?q=Ir.+HAIRUL+ANUAR+BIN+MOHD+TAHIR
Ir. HAJI OSMAN BIN AB RAHMAN,https://www.google.com/search?q=Ir.+HAJI+OSMAN+BIN+AB+RAHMAN
Ir. HALIM AZHAR BIN MOHD YATIM,https://www.google.com/search?q=Ir.+HALIM+AZHAR+BIN+MOHD+YATIM
Ir. HALIM MUSA BIN SAIRI,https://www.google.com/search?q=Ir.+HALIM+MUSA+BIN+SAIRI
Ir. HALIMI BIN ISMAIL,https://www.google.com/search?q=Ir.+HALIMI+BIN+ISMAIL
Ir. HAM MOW WAI,https://www.google.com/search?q=Ir.+HAM+MOW+WAI
Ir. HAMBALI BIN CHIK,https://www.google.com/search?q=Ir.+HAMBALI+BIN+CHIK
Ir. HAMBALI BIN HUSSEIN,https://www.google.com/search?q=Ir.+HAMBALI+BIN+HUSSEIN
Ir. HAMDAN BIN ZAKARIA,https://www.google.com/search?q=Ir.+HAMDAN+BIN+ZAKARIA
Ir. HAMILI BIN OMAR,https://www.google.com/search?q=Ir.+HAMILI+BIN+OMAR
Ir. HAMZAH BIN SALLEH,https://www.google.com/search?q=Ir.+HAMZAH+BIN+SALLEH
Ir. HANAFI BIN ALI,https://www.google.com/search?q=Ir.+HANAFI+BIN+ALI
Ir. HANAFI BIN NASIR,https://www.google.com/search?q=Ir.+HANAFI+BIN+NASIR
Ir. HANISAH BINTI HAN,https://www.google.com/search?q=Ir.+HANISAH+BINTI+HAN
Ir. HANIZA BINTI HARON,https://www.google.com/search?q=Ir.+HANIZA+BINTI+HARON
Ir. HANIZAN BIN MOHD HUSIN,https://www.google.com/search?q=Ir.+HANIZAN+BIN+MOHD+HUSIN
Ir. HAPIDA BT. GHAZALI,https://www.google.com/search?q=Ir.+HAPIDA+BT.+GHAZALI
Ir. HARBANS SINGH S/O KISHAN SINGH,https://www.google.com/search?q=Ir.+HARBANS+SINGH+S/O+KISHAN+SINGH
Ir. HARLIZA BT MOHD ROZALI,https://www.google.com/search?q=Ir.+HARLIZA+BT+MOHD+ROZALI
Ir. HARRIS BIN ABD RAHMAN SABRI,https://www.google.com/search?q=Ir.+HARRIS+BIN+ABD+RAHMAN+SABRI
Ir. HARRIS BIN BOSIKOL @ RAYNER HARRIS BIN JAMES,https://www.google.com/search?q=Ir.+HARRIS+BIN+BOSIKOL+@+RAYNER+HARRIS+BIN+JAMES
Ir. HASBULLAH BIN OSMAN,https://www.google.com/search?q=Ir.+HASBULLAH+BIN+OSMAN
Ir. HASHIM BIN HASSAN,https://www.google.com/search?q=Ir.+HASHIM+BIN+HASSAN
Ir. HASIM BIN OMAR,https://www.google.com/search?q=Ir.+HASIM+BIN+OMAR
Ir. HASLIZAN BIN HASHIM,https://www.google.com/search?q=Ir.+HASLIZAN+BIN+HASHIM
Ir. HASNIZAN BINTI HASHIM,https://www.google.com/search?q=Ir.+HASNIZAN+BINTI+HASHIM
Ir. HASRIL BIN HASINI,https://www.google.com/search?q=Ir.+HASRIL+BIN+HASINI
Ir. HASRIN BIN HASHIM,https://www.google.com/search?q=Ir.+HASRIN+BIN+HASHIM
Ir. HASRUL KAMAL,https://www.google.com/search?q=Ir.+HASRUL+KAMAL
Ir. HASSANAL IHZAL BIN KASSIM,https://www.google.com/search?q=Ir.+HASSANAL+IHZAL+BIN+KASSIM
Ir. HASSANAZHARI BIN AHDI,https://www.google.com/search?q=Ir.+HASSANAZHARI+BIN+AHDI
Ir. HASSANUDDIN BIN MD SALLEH,https://www.google.com/search?q=Ir.+HASSANUDDIN+BIN+MD+SALLEH
Ir. HAZMAN BIN MUHAMMAD,https://www.google.com/search?q=Ir.+HAZMAN+BIN+MUHAMMAD
Ir. HAZWAN BIN HASSAN,https://www.google.com/search?q=Ir.+HAZWAN+BIN+HASSAN
Ir. HENG SWEE NGEE,https://www.google.com/search?q=Ir.+HENG+SWEE+NGEE
Ir. HENG WENG LONG,https://www.google.com/search?q=Ir.+HENG+WENG+LONG
Ir. HENRY NG SAU CHAN,https://www.google.com/search?q=Ir.+HENRY+NG+SAU+CHAN
Ir. HEW LOKE MENG,https://www.google.com/search?q=Ir.+HEW+LOKE+MENG
Ir. HEW SHEN MAW,https://www.google.com/search?q=Ir.+HEW+SHEN+MAW
Ir. HILMI BIN HAIRUDDIN,https://www.google.com/search?q=Ir.+HILMI+BIN+HAIRUDDIN
Ir. HING FOOK YONG @ HENG FOOK YOONG,https://www.google.com/search?q=Ir.+HING+FOOK+YONG+@+HENG+FOOK+YOONG
Ir. HISHAM BIN MALEK @ HASHIM,https://www.google.com/search?q=Ir.+HISHAM+BIN+MALEK+@+HASHIM
Ir. HISHAM BIN MOKHTAR,https://www.google.com/search?q=Ir.+HISHAM+BIN+MOKHTAR
Ir. HJ KHALID BIN ESA,https://www.google.com/search?q=Ir.+HJ+KHALID+BIN+ESA
Ir. HO CHOON FEI,https://www.google.com/search?q=Ir.+HO+CHOON+FEI
Ir. HO JU NIEN,https://www.google.com/search?q=Ir.+HO+JU+NIEN
Ir. HO KENG KAI,https://www.google.com/search?q=Ir.+HO+KENG+KAI
Ir. HO KIEN SIONG,https://www.google.com/search?q=Ir.+HO+KIEN+SIONG
Ir. HO SZU MIN,https://www.google.com/search?q=Ir.+HO+SZU+MIN
Ir. HO TEIK LEE,https://www.google.com/search?q=Ir.+HO+TEIK+LEE
Ir. HO WENG KAI,https://www.google.com/search?q=Ir.+HO+WENG+KAI
Ir. HON HIN SEE,https://www.google.com/search?q=Ir.+HON+HIN+SEE
Ir. HOONG FAN WENG,https://www.google.com/search?q=Ir.+HOONG+FAN+WENG
Ir. HOONG FARN CHEONG ALVIN,https://www.google.com/search?q=Ir.+HOONG+FARN+CHEONG+ALVIN
Ir. HOR KOK LUEN,https://www.google.com/search?q=Ir.+HOR+KOK+LUEN
Ir. HOR POH MING,https://www.google.com/search?q=Ir.+HOR+POH+MING
Ir. HOW KOK PONG,https://www.google.com/search?q=Ir.+HOW+KOK+PONG
Ir. HOW YONG CHANG,https://www.google.com/search?q=Ir.+HOW+YONG+CHANG
Ir. HSIUNG KWO FANG,https://www.google.com/search?q=Ir.+HSIUNG+KWO+FANG
Ir. HUAN TECK TIONG,https://www.google.com/search?q=Ir.+HUAN+TECK+TIONG
Ir. HUN SENG KWANG,https://www.google.com/search?q=Ir.+HUN+SENG+KWANG
Ir. HUSSIEN BIN JUHARI,https://www.google.com/search?q=Ir.+HUSSIEN+BIN+JUHARI
Ir. HUSSIN MAMAT,https://www.google.com/search?q=Ir.+HUSSIN+MAMAT
Ir. HUZAIRIYAH BINTI HUSSIN,https://www.google.com/search?q=Ir.+HUZAIRIYAH+BINTI+HUSSIN
Ir. HWANG YEE FAN,https://www.google.com/search?q=Ir.+HWANG+YEE+FAN
Ir. IBRAHIM BIN MOHAMAD,https://www.google.com/search?q=Ir.+IBRAHIM+BIN+MOHAMAD
Ir. ICAHRI BIN HJ CHATTA,https://www.google.com/search?q=Ir.+ICAHRI+BIN+HJ+CHATTA
Ir. IDRIS BIN IBRAHIM (C),https://www.google.com/search?q=Ir.+IDRIS+BIN+IBRAHIM+(C)
Ir. IKHWAN BIN MD TAB,https://www.google.com/search?q=Ir.+IKHWAN+BIN+MD+TAB
Ir. IKHWAN MOEID BIN ISHAK,https://www.google.com/search?q=Ir.+IKHWAN+MOEID+BIN+ISHAK
Ir. ILANGOVAN KARUPIAH,https://www.google.com/search?q=Ir.+ILANGOVAN+KARUPIAH
Ir. ILIAS BIN YAHYA,https://www.google.com/search?q=Ir.+ILIAS+BIN+YAHYA
Ir. IRFAH BINTI ISMAIL,https://www.google.com/search?q=Ir.+IRFAH+BINTI+ISMAIL
Ir. IRMA SURYATI BINTI HAMID,https://www.google.com/search?q=Ir.+IRMA+SURYATI+BINTI+HAMID
Ir. IRWAN BIN PODIN,https://www.google.com/search?q=Ir.+IRWAN+BIN+PODIN
Ir. ISFANIZAM BIN ISMAIL,https://www.google.com/search?q=Ir.+ISFANIZAM+BIN+ISMAIL
Ir. ISHAK BIN ABDUL MOIN,https://www.google.com/search?q=Ir.+ISHAK+BIN+ABDUL+MOIN
Ir. ISHRAQI BIN MOHD NOR,https://www.google.com/search?q=Ir.+ISHRAQI+BIN+MOHD+NOR
Ir. ISMADY BIN ISMAIL,https://www.google.com/search?q=Ir.+ISMADY+BIN+ISMAIL
Ir. ISMAIL BIN HARON,https://www.google.com/search?q=Ir.+ISMAIL+BIN+HARON
Ir. ISMAIL BIN KHALID,https://www.google.com/search?q=Ir.+ISMAIL+BIN+KHALID
Ir. ISZUAN SHAH BIN SYED ISMAIL,https://www.google.com/search?q=Ir.+ISZUAN+SHAH+BIN+SYED+ISMAIL
Ir. IZAMI ZUDDIN ABDUL RANI,https://www.google.com/search?q=Ir.+IZAMI+ZUDDIN+ABDUL+RANI
Ir. IZANI BIN MUSTAPHA,https://www.google.com/search?q=Ir.+IZANI+BIN+MUSTAPHA
Ir. IZLAN BIN ISMAIL,https://www.google.com/search?q=Ir.+IZLAN+BIN+ISMAIL
Ir. IZRUL BIN IDRIS,https://www.google.com/search?q=Ir.+IZRUL+BIN+IDRIS
Ir. JAGJIT SINGH,https://www.google.com/search?q=Ir.+JAGJIT+SINGH
Ir. JALALUDDIN BIN MOHD ZIN,https://www.google.com/search?q=Ir.+JALALUDDIN+BIN+MOHD+ZIN
Ir. JAMALUDDIN BIN ASMUNI,https://www.google.com/search?q=Ir.+JAMALUDDIN+BIN+ASMUNI
Ir. JAMALUDIN BIN HUSSAIN,https://www.google.com/search?q=Ir.+JAMALUDIN+BIN+HUSSAIN
Ir. JAMALUDIN BIN MUSTAKIM,https://www.google.com/search?q=Ir.+JAMALUDIN+BIN+MUSTAKIM
Ir. JAMES TEO SU HAN,https://www.google.com/search?q=Ir.+JAMES+TEO+SU+HAN
Ir. JASLANI BIN AHMAD SHAARANI,https://www.google.com/search?q=Ir.+JASLANI+BIN+AHMAD+SHAARANI
Ir. JASON GOH CHIA CHUAN,https://www.google.com/search?q=Ir.+JASON+GOH+CHIA+CHUAN
Ir. JAYA PRATHAB A/L T ARUMUGAM,https://www.google.com/search?q=Ir.+JAYA+PRATHAB+A/L+T+ARUMUGAM
Ir. JAYARAM A/L KRISHNA,https://www.google.com/search?q=Ir.+JAYARAM+A/L+KRISHNA
Ir. JAZLEE BIN MOHD ALIAS,https://www.google.com/search?q=Ir.+JAZLEE+BIN+MOHD+ALIAS
Ir. JERRY KHOO KEAT HUAT,https://www.google.com/search?q=Ir.+JERRY+KHOO+KEAT+HUAT
Ir. JOHAN BIN ABDUL JALIL,https://www.google.com/search?q=Ir.+JOHAN+BIN+ABDUL+JALIL
Ir. JOHARI BIN MOHD NOOR,https://www.google.com/search?q=Ir.+JOHARI+BIN+MOHD+NOOR
Ir. JOHN ONG YAP HUN,https://www.google.com/search?q=Ir.+JOHN+ONG+YAP+HUN
Ir. JOKOLIN JOMINIT,https://www.google.com/search?q=Ir.+JOKOLIN+JOMINIT
Ir. JONG FUNG SWEE,https://www.google.com/search?q=Ir.+JONG+FUNG+SWEE
Ir. JONG HOWE JOO STEPHENSON,https://www.google.com/search?q=Ir.+JONG+HOWE+JOO+STEPHENSON
Ir. JONG MIN KONG @ JOSEPH YONG,https://www.google.com/search?q=Ir.+JONG+MIN+KONG+@+JOSEPH+YONG
Ir. JONG NYUK NANG @ ANDREW,https://www.google.com/search?q=Ir.+JONG+NYUK+NANG+@+ANDREW
Ir. JUHARI BIN HUSIN,https://www.google.com/search?q=Ir.+JUHARI+BIN+HUSIN
Ir. JULIAN SAW CHERN-YANN,https://www.google.com/search?q=Ir.+JULIAN+SAW+CHERN-YANN
Ir. JUMARI BIN PORMAN,https://www.google.com/search?q=Ir.+JUMARI+BIN+PORMAN
Ir. JUNAIDI MUSLIM,https://www.google.com/search?q=Ir.+JUNAIDI+MUSLIM
Ir. K P MUKUND TARURHARI GOVINDAN,https://www.google.com/search?q=Ir.+K+P+MUKUND+TARURHARI+GOVINDAN
Ir. KALWANT SINGH S/O RATTAN SINGH,https://www.google.com/search?q=Ir.+KALWANT+SINGH+S/O+RATTAN+SINGH
Ir. KALYANA LAKSHMI RAMAN,https://www.google.com/search?q=Ir.+KALYANA+LAKSHMI+RAMAN
Ir. KAMAL BIN WOK,https://www.google.com/search?q=Ir.+KAMAL+BIN+WOK
Ir. KAMAL RUSULAN BIN MOHAMED,https://www.google.com/search?q=Ir.+KAMAL+RUSULAN+BIN+MOHAMED
Ir. KAMARDIN BIN MD TOP,https://www.google.com/search?q=Ir.+KAMARDIN+BIN+MD+TOP
Ir. KAMARIAH BINTI IBRAHIM,https://www.google.com/search?q=Ir.+KAMARIAH+BINTI+IBRAHIM
Ir. KAMARUDDIN BIN AB GHANI,https://www.google.com/search?q=Ir.+KAMARUDDIN+BIN+AB+GHANI
Ir. KAMARUDDIN BIN ABD AZIZ,https://www.google.com/search?q=Ir.+KAMARUDDIN+BIN+ABD+AZIZ
Ir. KAMARUDIN BIN SAHAR,https://www.google.com/search?q=Ir.+KAMARUDIN+BIN+SAHAR
Ir. KAMARUL AZHAR BIN ABDULLAH,https://www.google.com/search?q=Ir.+KAMARUL+AZHAR+BIN+ABDULLAH
Ir. KAMARULZAMAN BIN IBRAHIM,https://www.google.com/search?q=Ir.+KAMARULZAMAN+BIN+IBRAHIM
Ir. KANAGARAJ SUBRAMANIAM,https://www.google.com/search?q=Ir.+KANAGARAJ+SUBRAMANIAM
Ir. KANESA VATHANAN A/L SUBRAMANIAM,https://www.google.com/search?q=Ir.+KANESA+VATHANAN+A/L+SUBRAMANIAM
Ir. KANNAN A/L M. MUNISAMY,https://www.google.com/search?q=Ir.+KANNAN+A/L+M.+MUNISAMY
Ir. KASBUN BIN KAMAT,https://www.google.com/search?q=Ir.+KASBUN+BIN+KAMAT
Ir. KASIM BIN AHMAD,https://www.google.com/search?q=Ir.+KASIM+BIN+AHMAD
Ir. KAZREN JUSRI BIN ABDUL KARIM,https://www.google.com/search?q=Ir.+KAZREN+JUSRI+BIN+ABDUL+KARIM
Ir. KE GEOK CHUAN,https://www.google.com/search?q=Ir.+KE+GEOK+CHUAN
Ir. KESAVAN A/L JAGANATHAN,https://www.google.com/search?q=Ir.+KESAVAN+A/L+JAGANATHAN
Ir. KET CHEONG PAN,https://www.google.com/search?q=Ir.+KET+CHEONG+PAN
Ir. KEVIN CHIA HOONG SUM,https://www.google.com/search?q=Ir.+KEVIN+CHIA+HOONG+SUM
Ir. KEW KHAK WAI,https://www.google.com/search?q=Ir.+KEW+KHAK+WAI
Ir. KHAIRUDDIN BIN SHAMSUDIN,https://www.google.com/search?q=Ir.+KHAIRUDDIN+BIN+SHAMSUDIN
Ir. KHAIRUDIN BIN MOHAMED ATIULLAH,https://www.google.com/search?q=Ir.+KHAIRUDIN+BIN+MOHAMED+ATIULLAH
Ir. KHAIRUL ANNUAR SULAIMAN,https://www.google.com/search?q=Ir.+KHAIRUL+ANNUAR+SULAIMAN
Ir. KHAIRUL ANUAR BIN MAHBOB,https://www.google.com/search?q=Ir.+KHAIRUL+ANUAR+BIN+MAHBOB
Ir. KHAIRUL ANUAR BIN MOHD HASHIM,https://www.google.com/search?q=Ir.+KHAIRUL+ANUAR+BIN+MOHD+HASHIM
Ir. KHAIRUL AZRI BIN ISHAK,https://www.google.com/search?q=Ir.+KHAIRUL+AZRI+BIN+ISHAK
Ir. KHAIRUL FAIZI BIN HAJI KHALID,https://www.google.com/search?q=Ir.+KHAIRUL+FAIZI+BIN+HAJI+KHALID
Ir. KHAIRUL IZHAM BIN HALIL,https://www.google.com/search?q=Ir.+KHAIRUL+IZHAM+BIN+HALIL
Ir. KHAIRUL NIZAM BIN JASMAN,https://www.google.com/search?q=Ir.+KHAIRUL+NIZAM+BIN+JASMAN
Ir. KHAIRUL NIZAM BIN MOHAMED SUTTAN,https://www.google.com/search?q=Ir.+KHAIRUL+NIZAM+BIN+MOHAMED+SUTTAN
Ir. KHALID ABU BAKAR,https://www.google.com/search?q=Ir.+KHALID+ABU+BAKAR
Ir. KHALID BIN ABD JALIL,https://www.google.com/search?q=Ir.+KHALID+BIN+ABD+JALIL
Ir. KHALID BIN AHMAD,https://www.google.com/search?q=Ir.+KHALID+BIN+AHMAD
Ir. KHAW EAN KEE,https://www.google.com/search?q=Ir.+KHAW+EAN+KEE
Ir. KHO LIANG KUNG,https://www.google.com/search?q=Ir.+KHO+LIANG+KUNG
Ir. KHOO BOO HON,https://www.google.com/search?q=Ir.+KHOO+BOO+HON
Ir. KHOO ENG SHYUAN,https://www.google.com/search?q=Ir.+KHOO+ENG+SHYUAN
Ir. KHOR SWEK LIEH DELVAN,https://www.google.com/search?q=Ir.+KHOR+SWEK+LIEH+DELVAN
Ir. KHUSZA'ERAN MOHAMED,https://www.google.com/search?q=Ir.+KHUSZA'ERAN+MOHAMED
Ir. KOAY HAI SIU,https://www.google.com/search?q=Ir.+KOAY+HAI+SIU
Ir. KOH CHEE KEONG,https://www.google.com/search?q=Ir.+KOH+CHEE+KEONG
Ir. KOH CHIN LAI,https://www.google.com/search?q=Ir.+KOH+CHIN+LAI
Ir. KOH VOON LI,https://www.google.com/search?q=Ir.+KOH+VOON+LI
Ir. KOK WENG KONG,https://www.google.com/search?q=Ir.+KOK+WENG+KONG
Ir. KONG CHONG SANG,https://www.google.com/search?q=Ir.+KONG+CHONG+SANG
Ir. KONG KOK HAW,https://www.google.com/search?q=Ir.+KONG+KOK+HAW
Ir. KOO MENG CHIU,https://www.google.com/search?q=Ir.+KOO+MENG+CHIU
Ir. KOO SHUANG CHYUAN,https://www.google.com/search?q=Ir.+KOO+SHUANG+CHYUAN
Ir. KORMAIN BIN HJ MOHD NOOR,https://www.google.com/search?q=Ir.+KORMAIN+BIN+HJ+MOHD+NOOR
Ir. KS LEE,https://www.google.com/search?q=Ir.+KS+LEE
Ir. KU SIM AIK,https://www.google.com/search?q=Ir.+KU+SIM+AIK
