Name_name,Google Link Redirect
Ir. KUA CHIN TEE,https://www.google.com/search?q=Ir.+KUA+CHIN+TEE
Ir. KUAN CHIN JONG,https://www.google.com/search?q=Ir.+KUAN+CHIN+JONG
Ir. KUEH JIN FONG,https://www.google.com/search?q=Ir.+KUEH+JIN+FONG
Ir. KUMARASON A/L S KANDIAH,https://www.google.com/search?q=Ir.+KUMARASON+A/L+S+KANDIAH
Ir. KUNASINGAM S/O ARUMUGAM,https://www.google.com/search?q=Ir.+KUNASINGAM+S/O+ARUMUGAM
Ir. KWONG KIA TENG,https://www.google.com/search?q=Ir.+KWONG+KIA+TENG
Ir. LAI AH KIAW,https://www.google.com/search?q=Ir.+LAI+AH+KIAW
Ir. LAI AH YING,https://www.google.com/search?q=Ir.+LAI+AH+YING
Ir. LAI CHEE KUAN,https://www.google.com/search?q=Ir.+LAI+CHEE+KUAN
Ir. LAI CHING KEONG,https://www.google.com/search?q=Ir.+LAI+CHING+KEONG
Ir. LAI KAI CHIN @ LAI KAI MING,https://www.google.com/search?q=Ir.+LAI+KAI+CHIN+@+LAI+KAI+MING
Ir. LAI KHOON WAH,https://www.google.com/search?q=Ir.+LAI+KHOON+WAH
Ir. LAI SZE CHING,https://www.google.com/search?q=Ir.+LAI+SZE+CHING
Ir. LAI YEE KEIN,https://www.google.com/search?q=Ir.+LAI+YEE+KEIN
Ir. LAI YEW HONG,https://www.google.com/search?q=Ir.+LAI+YEW+HONG
Ir. LAM CHEE WOOI,https://www.google.com/search?q=Ir.+LAM+CHEE+WOOI
Ir. LAM KAI EN,https://www.google.com/search?q=Ir.+LAM+KAI+EN
Ir. LAM KAI MIN,https://www.google.com/search?q=Ir.+LAM+KAI+MIN
Ir. LAM KIM SEONG,https://www.google.com/search?q=Ir.+LAM+KIM+SEONG
Ir. LAU CHEE KHIN,https://www.google.com/search?q=Ir.+LAU+CHEE+KHIN
Ir. LAU CHIN SHENG,https://www.google.com/search?q=Ir.+LAU+CHIN+SHENG
Ir. LAU CHUANG BING,https://www.google.com/search?q=Ir.+LAU+CHUANG+BING
Ir. LAU PEI CHEN,https://www.google.com/search?q=Ir.+LAU+PEI+CHEN
Ir. LAU SIEW KEE PAUL,https://www.google.com/search?q=Ir.+LAU+SIEW+KEE+PAUL
Ir. LAU SUN WAH,https://www.google.com/search?q=Ir.+LAU+SUN+WAH
Ir. LAU YEW TOONG,https://www.google.com/search?q=Ir.+LAU+YEW+TOONG
Ir. LAW HIENG HUI JOSEPH,https://www.google.com/search?q=Ir.+LAW+HIENG+HUI+JOSEPH
Ir. LAW KWONG LING,https://www.google.com/search?q=Ir.+LAW+KWONG+LING
Ir. LEAN MENG KIAT,https://www.google.com/search?q=Ir.+LEAN+MENG+KIAT
Ir. LEE AH SOON @ LEE KIM SOON,https://www.google.com/search?q=Ir.+LEE+AH+SOON+@+LEE+KIM+SOON
Ir. LEE CHANG CHEE,https://www.google.com/search?q=Ir.+LEE+CHANG+CHEE
Ir. LEE CHANG QUAN,https://www.google.com/search?q=Ir.+LEE+CHANG+QUAN
Ir. LEE CHE CHUAN,https://www.google.com/search?q=Ir.+LEE+CHE+CHUAN
Ir. LEE CHEE SEONG,https://www.google.com/search?q=Ir.+LEE+CHEE+SEONG
Ir. LEE CHIN AUN,https://www.google.com/search?q=Ir.+LEE+CHIN+AUN
Ir. LEE CHUN WAI @ LAI CHIN WAI,https://www.google.com/search?q=Ir.+LEE+CHUN+WAI+@+LAI+CHIN+WAI
Ir. LEE EE ME,https://www.google.com/search?q=Ir.+LEE+EE+ME
Ir. LEE HENG TING,https://www.google.com/search?q=Ir.+LEE+HENG+TING
Ir. LEE HENG YUEN,https://www.google.com/search?q=Ir.+LEE+HENG+YUEN
Ir. LEE HOCK LOONG,https://www.google.com/search?q=Ir.+LEE+HOCK+LOONG
Ir. LEE HUNG SOON,https://www.google.com/search?q=Ir.+LEE+HUNG+SOON
Ir. LEE JUAN JYM,https://www.google.com/search?q=Ir.+LEE+JUAN+JYM
Ir. LEE KEAN YEW,https://www.google.com/search?q=Ir.+LEE+KEAN+YEW
Ir. LEE KEH REN,https://www.google.com/search?q=Ir.+LEE+KEH+REN
Ir. LEE KHEK MUI,https://www.google.com/search?q=Ir.+LEE+KHEK+MUI
Ir. LEE KOK SIONG,https://www.google.com/search?q=Ir.+LEE+KOK+SIONG
Ir. LEE KONG FAN,https://www.google.com/search?q=Ir.+LEE+KONG+FAN
Ir. LEE LAM,https://www.google.com/search?q=Ir.+LEE+LAM
Ir. LEE MEAU KON,https://www.google.com/search?q=Ir.+LEE+MEAU+KON
Ir. LEE MOOK SWEE LARRY,https://www.google.com/search?q=Ir.+LEE+MOOK+SWEE+LARRY
Ir. LEE MUN POH,https://www.google.com/search?q=Ir.+LEE+MUN+POH
Ir. LEE PENG TIAN,https://www.google.com/search?q=Ir.+LEE+PENG+TIAN
Ir. LEE POH HOCK CHRISTOPHER,https://www.google.com/search?q=Ir.+LEE+POH+HOCK+CHRISTOPHER
Ir. LEE SIAN KIAT @ LEE SHIONG PING,https://www.google.com/search?q=Ir.+LEE+SIAN+KIAT+@+LEE+SHIONG+PING
Ir. LEE TIAN FOOK,https://www.google.com/search?q=Ir.+LEE+TIAN+FOOK
Ir. LEE TZE LIN,https://www.google.com/search?q=Ir.+LEE+TZE+LIN
Ir. LEE WAI NENG,https://www.google.com/search?q=Ir.+LEE+WAI+NENG
Ir. LEE YEE SENG,https://www.google.com/search?q=Ir.+LEE+YEE+SENG
Ir. LEE YIN FAH,https://www.google.com/search?q=Ir.+LEE+YIN+FAH
Ir. LEM YAL MING,https://www.google.com/search?q=Ir.+LEM+YAL+MING
Ir. LENNY MARLINA BINTI MOHD KAIRI,https://www.google.com/search?q=Ir.+LENNY+MARLINA+BINTI+MOHD+KAIRI
Ir. LENSUS ANAK MET,https://www.google.com/search?q=Ir.+LENSUS+ANAK+MET
Ir. LEONG CHENG THIM,https://www.google.com/search?q=Ir.+LEONG+CHENG+THIM
Ir. LEONG HON WAH,https://www.google.com/search?q=Ir.+LEONG+HON+WAH
Ir. LEONG KONG HENG,https://www.google.com/search?q=Ir.+LEONG+KONG+HENG
Ir. LEONG PENG SENG,https://www.google.com/search?q=Ir.+LEONG+PENG+SENG
Ir. LEONG SAIK KONG,https://www.google.com/search?q=Ir.+LEONG+SAIK+KONG
Ir. LEONG SEAK WAI,https://www.google.com/search?q=Ir.+LEONG+SEAK+WAI
Ir. LEONG SIEW MENG,https://www.google.com/search?q=Ir.+LEONG+SIEW+MENG
Ir. LEONG TEONG ENG,https://www.google.com/search?q=Ir.+LEONG+TEONG+ENG
Ir. LEONG WAI TAK,https://www.google.com/search?q=Ir.+LEONG+WAI+TAK
Ir. LEOW CHEE HUAN,https://www.google.com/search?q=Ir.+LEOW+CHEE+HUAN
Ir. LEOW SAM NYIN,https://www.google.com/search?q=Ir.+LEOW+SAM+NYIN
Ir. LEW SAN CHONG,https://www.google.com/search?q=Ir.+LEW+SAN+CHONG
Ir. LIAO CHI KUANG,https://www.google.com/search?q=Ir.+LIAO+CHI+KUANG
Ir. LIAU KOK LENG,https://www.google.com/search?q=Ir.+LIAU+KOK+LENG
Ir. LIAW SIN ANN,https://www.google.com/search?q=Ir.+LIAW+SIN+ANN
Ir. LIEW FOOK KIEW FRANKIE,https://www.google.com/search?q=Ir.+LIEW+FOOK+KIEW+FRANKIE
Ir. LIEW KON KEONG @ KOK KEONG,https://www.google.com/search?q=Ir.+LIEW+KON+KEONG+@+KOK+KEONG
Ir. LIEW KUOK JEW,https://www.google.com/search?q=Ir.+LIEW+KUOK+JEW
Ir. LIEW LEONG TING,https://www.google.com/search?q=Ir.+LIEW+LEONG+TING
Ir. LIEW LUI YUE,https://www.google.com/search?q=Ir.+LIEW+LUI+YUE
Ir. LIEW SUI KUM,https://www.google.com/search?q=Ir.+LIEW+SUI+KUM
Ir. LIEW TEIK SHIN,https://www.google.com/search?q=Ir.+LIEW+TEIK+SHIN
Ir. LIEW TZE CHONG,https://www.google.com/search?q=Ir.+LIEW+TZE+CHONG
Ir. LIEW YAN SIN,https://www.google.com/search?q=Ir.+LIEW+YAN+SIN
Ir. LIM AIK SENG,https://www.google.com/search?q=Ir.+LIM+AIK+SENG
Ir. LIM BENG HIAN,https://www.google.com/search?q=Ir.+LIM+BENG+HIAN
Ir. LIM BOK KONG,https://www.google.com/search?q=Ir.+LIM+BOK+KONG
Ir. LIM BOON HAI,https://www.google.com/search?q=Ir.+LIM+BOON+HAI
Ir. LIM BOON YOKE,https://www.google.com/search?q=Ir.+LIM+BOON+YOKE
Ir. LIM CHAN SHEE,https://www.google.com/search?q=Ir.+LIM+CHAN+SHEE
Ir. LIM CHEE KIAN,https://www.google.com/search?q=Ir.+LIM+CHEE+KIAN
Ir. LIM CHEE KIANG,https://www.google.com/search?q=Ir.+LIM+CHEE+KIANG
Ir. LIM CHEE WEI,https://www.google.com/search?q=Ir.+LIM+CHEE+WEI
Ir. LIM CHONG HU,https://www.google.com/search?q=Ir.+LIM+CHONG+HU
Ir. LIM ENG HWA,https://www.google.com/search?q=Ir.+LIM+ENG+HWA
Ir. LIM FOONG LING,https://www.google.com/search?q=Ir.+LIM+FOONG+LING
Ir. LIM GIM HONG,https://www.google.com/search?q=Ir.+LIM+GIM+HONG
Ir. LIM GUANG-MING,https://www.google.com/search?q=Ir.+LIM+GUANG-MING
Ir. LIM HOCK BOON,https://www.google.com/search?q=Ir.+LIM+HOCK+BOON
Ir. LIM HOCK GUAN,https://www.google.com/search?q=Ir.+LIM+HOCK+GUAN
Ir. LIM HOK LIAN,https://www.google.com/search?q=Ir.+LIM+HOK+LIAN
Ir. LIM HOU,https://www.google.com/search?q=Ir.+LIM+HOU
Ir. LIM JIN LUN,https://www.google.com/search?q=Ir.+LIM+JIN+LUN
Ir. LIM JIT SHIN,https://www.google.com/search?q=Ir.+LIM+JIT+SHIN
Ir. LIM JOO CHAI,https://www.google.com/search?q=Ir.+LIM+JOO+CHAI
Ir. LIM KAY BENG,https://www.google.com/search?q=Ir.+LIM+KAY+BENG
Ir. LIM KEAN SENG,https://www.google.com/search?q=Ir.+LIM+KEAN+SENG
Ir. LIM KEK SIA,https://www.google.com/search?q=Ir.+LIM+KEK+SIA
Ir. LIM KIAN HWA,https://www.google.com/search?q=Ir.+LIM+KIAN+HWA
Ir. LIM KIM BAK,https://www.google.com/search?q=Ir.+LIM+KIM+BAK
Ir. LIM KIM CHUAN DANIEL,https://www.google.com/search?q=Ir.+LIM+KIM+CHUAN+DANIEL
Ir. LIM KIM TENG,https://www.google.com/search?q=Ir.+LIM+KIM+TENG
Ir. Lim KOK ONN,https://www.google.com/search?q=Ir.+Lim+KOK+ONN
Ir. LIM KWEE TIONG,https://www.google.com/search?q=Ir.+LIM+KWEE+TIONG
Ir. LIM LEE THON,https://www.google.com/search?q=Ir.+LIM+LEE+THON
Ir. LIM LEONG BOK,https://www.google.com/search?q=Ir.+LIM+LEONG+BOK
Ir. LIM LIP KEONG,https://www.google.com/search?q=Ir.+LIM+LIP+KEONG
Ir. LIM LYE CHUAN,https://www.google.com/search?q=Ir.+LIM+LYE+CHUAN
Ir. LIM MENG SEN,https://www.google.com/search?q=Ir.+LIM+MENG+SEN
Ir. LIM RUEY FWU,https://www.google.com/search?q=Ir.+LIM+RUEY+FWU
Ir. LIM SANG HOONG,https://www.google.com/search?q=Ir.+LIM+SANG+HOONG
Ir. LIM SEONG HING,https://www.google.com/search?q=Ir.+LIM+SEONG+HING
Ir. LIM SHAW CHONG,https://www.google.com/search?q=Ir.+LIM+SHAW+CHONG
Ir. LIM SWEE FAH,https://www.google.com/search?q=Ir.+LIM+SWEE+FAH
Ir. LIM SWEE HONG,https://www.google.com/search?q=Ir.+LIM+SWEE+HONG
Ir. LIM SWEE YAM,https://www.google.com/search?q=Ir.+LIM+SWEE+YAM
Ir. LIM SZE WI,https://www.google.com/search?q=Ir.+LIM+SZE+WI
Ir. LIM TECK SIN @ LIM TECK SENG,https://www.google.com/search?q=Ir.+LIM+TECK+SIN+@+LIM+TECK+SENG
Ir. LIM TENG HOO,https://www.google.com/search?q=Ir.+LIM+TENG+HOO
Ir. LIM THOU KIONG,https://www.google.com/search?q=Ir.+LIM+THOU+KIONG
Ir. LIM THOU LAI,https://www.google.com/search?q=Ir.+LIM+THOU+LAI
Ir. LIM THUAN SWEE,https://www.google.com/search?q=Ir.+LIM+THUAN+SWEE
Ir. LIM TIAN LU,https://www.google.com/search?q=Ir.+LIM+TIAN+LU
Ir. LIM VIN TZE,https://www.google.com/search?q=Ir.+LIM+VIN+TZE
Ir. LIM WAI LING,https://www.google.com/search?q=Ir.+LIM+WAI+LING
Ir. LIM WAI TAT,https://www.google.com/search?q=Ir.+LIM+WAI+TAT
Ir. LIM WEI SIANG,https://www.google.com/search?q=Ir.+LIM+WEI+SIANG
Ir. LIM YEAN TIT,https://www.google.com/search?q=Ir.+LIM+YEAN+TIT
Ir. LIM YEN SIANG,https://www.google.com/search?q=Ir.+LIM+YEN+SIANG
Ir. LIM YEW JIN,https://www.google.com/search?q=Ir.+LIM+YEW+JIN
Ir. LING KUOK NGIEK DOMINIC,https://www.google.com/search?q=Ir.+LING+KUOK+NGIEK+DOMINIC
Ir. LING NGIE SOON,https://www.google.com/search?q=Ir.+LING+NGIE+SOON
Ir. LING SOON YICK,https://www.google.com/search?q=Ir.+LING+SOON+YICK
Ir. LING TUONG THAI,https://www.google.com/search?q=Ir.+LING+TUONG+THAI
Ir. LIT MOON CHEW,https://www.google.com/search?q=Ir.+LIT+MOON+CHEW
Ir. LO HO MIN,https://www.google.com/search?q=Ir.+LO+HO+MIN
Ir. LOH CHONG HUI,https://www.google.com/search?q=Ir.+LOH+CHONG+HUI
Ir. LOH CHONG SIA,https://www.google.com/search?q=Ir.+LOH+CHONG+SIA
Ir. LOH SIN SENG,https://www.google.com/search?q=Ir.+LOH+SIN+SENG
Ir. LOH TECK ANN,https://www.google.com/search?q=Ir.+LOH+TECK+ANN
Ir. LOH TED SUN,https://www.google.com/search?q=Ir.+LOH+TED+SUN
Ir. LOH THIM THAK,https://www.google.com/search?q=Ir.+LOH+THIM+THAK
Ir. LOI TIK WEI PHILIP,https://www.google.com/search?q=Ir.+LOI+TIK+WEI+PHILIP
Ir. LOKE KOK YEONG,https://www.google.com/search?q=Ir.+LOKE+KOK+YEONG
Ir. LOKMAN BIN AB KADIR,https://www.google.com/search?q=Ir.+LOKMAN+BIN+AB+KADIR
Ir. LOKMAN BIN MOHD NOH,https://www.google.com/search?q=Ir.+LOKMAN+BIN+MOHD+NOH
Ir. LOO CHENG TIONG,https://www.google.com/search?q=Ir.+LOO+CHENG+TIONG
Ir. LOO MOON WHAI,https://www.google.com/search?q=Ir.+LOO+MOON+WHAI
Ir. LOO SIOK HOOI,https://www.google.com/search?q=Ir.+LOO+SIOK+HOOI
Ir. LOO WEN SIANG,https://www.google.com/search?q=Ir.+LOO+WEN+SIANG
Ir. LOO YEOW CHUEN,https://www.google.com/search?q=Ir.+LOO+YEOW+CHUEN
Ir. LOON CHIN MENG,https://www.google.com/search?q=Ir.+LOON+CHIN+MENG
Ir. LOONG YEE KOH,https://www.google.com/search?q=Ir.+LOONG+YEE+KOH
Ir. LOSIOS KIMIN,https://www.google.com/search?q=Ir.+LOSIOS+KIMIN
Ir. LOURDES RAJ A/L DHOMNIC,https://www.google.com/search?q=Ir.+LOURDES+RAJ+A/L+DHOMNIC
Ir. LOW CHEW EOW,https://www.google.com/search?q=Ir.+LOW+CHEW+EOW
Ir. LOW GUAN TUI,https://www.google.com/search?q=Ir.+LOW+GUAN+TUI
Ir. LOW HAN GUAN,https://www.google.com/search?q=Ir.+LOW+HAN+GUAN
Ir. LOW KIA KIT,https://www.google.com/search?q=Ir.+LOW+KIA+KIT
Ir. LOW LIAN AIK,https://www.google.com/search?q=Ir.+LOW+LIAN+AIK
Ir. LOW SENG SOON,https://www.google.com/search?q=Ir.+LOW+SENG+SOON
Ir. LOY TAI WAH,https://www.google.com/search?q=Ir.+LOY+TAI+WAH
Ir. LUDHSIAH BINTI MUHAMAD SAIRI,https://www.google.com/search?q=Ir.+LUDHSIAH+BINTI+MUHAMAD+SAIRI
Ir. LUK CHAU BENG,https://www.google.com/search?q=Ir.+LUK+CHAU+BENG
Ir. LUKMAN BIN MD AKIM,https://www.google.com/search?q=Ir.+LUKMAN+BIN+MD+AKIM
Ir. LUKMAN BIN SALLEH,https://www.google.com/search?q=Ir.+LUKMAN+BIN+SALLEH
Ir. LUM WAI LEONG,https://www.google.com/search?q=Ir.+LUM+WAI+LEONG
Ir. LUM WEE SEANG,https://www.google.com/search?q=Ir.+LUM+WEE+SEANG
Ir. LUM YOUK LEE,https://www.google.com/search?q=Ir.+LUM+YOUK+LEE
Ir. LYE KAH HSIUNG,https://www.google.com/search?q=Ir.+LYE+KAH+HSIUNG
Ir. M KERBANANDHAN PILLAY,https://www.google.com/search?q=Ir.+M+KERBANANDHAN+PILLAY
Ir. MA MENG FOOK,https://www.google.com/search?q=Ir.+MA+MENG+FOOK
Ir. MADHU SOOTHANAN A/L VELAYUTHAM,https://www.google.com/search?q=Ir.+MADHU+SOOTHANAN+A/L+VELAYUTHAM
Ir. MAHADHIR BIN MANAN,https://www.google.com/search?q=Ir.+MAHADHIR+BIN+MANAN
Ir. MAHADHIR BIN MUSTAFFA,https://www.google.com/search?q=Ir.+MAHADHIR+BIN+MUSTAFFA
Ir. MAHAT A/L MAT DONG,https://www.google.com/search?q=Ir.+MAHAT+A/L+MAT+DONG
Ir. MAHENTHIRAN A/L M KANDASAMY,https://www.google.com/search?q=Ir.+MAHENTHIRAN+A/L+M+KANDASAMY
Ir. MAHMOOD AZMY BIN MUHAMMAD SHUKRI,https://www.google.com/search?q=Ir.+MAHMOOD+AZMY+BIN+MUHAMMAD+SHUKRI
Ir. MAIKAL DAS A/L PICHAY,https://www.google.com/search?q=Ir.+MAIKAL+DAS+A/L+PICHAY
Ir. MALEK BIN HISHAM,https://www.google.com/search?q=Ir.+MALEK+BIN+HISHAM
Ir. MALEK FAIZAL BIN IDRUS,https://www.google.com/search?q=Ir.+MALEK+FAIZAL+BIN+IDRUS
Ir. MAMAT ROHIZAN BIN ABDULLAH,https://www.google.com/search?q=Ir.+MAMAT+ROHIZAN+BIN+ABDULLAH
Ir. MANOEL FRANCISCO AVELINO GOMES,https://www.google.com/search?q=Ir.+MANOEL+FRANCISCO+AVELINO+GOMES
Ir. MARDIANTO BIN ASLI,https://www.google.com/search?q=Ir.+MARDIANTO+BIN+ASLI
Ir. MARTHIAH BINTI HASHIM,https://www.google.com/search?q=Ir.+MARTHIAH+BINTI+HASHIM
Ir. MASHITAH BT HAJI MD JAIS,https://www.google.com/search?q=Ir.+MASHITAH+BT+HAJI+MD+JAIS
Ir. MASKAN BIN MD HASSAN,https://www.google.com/search?q=Ir.+MASKAN+BIN+MD+HASSAN
Ir. MASLINDA BINTI MOHAMED,https://www.google.com/search?q=Ir.+MASLINDA+BINTI+MOHAMED
Ir. MAT ZAINI BIN SURIP,https://www.google.com/search?q=Ir.+MAT+ZAINI+BIN+SURIP
Ir. MATHEN KUMAR A/L RAMACHENDRAM,https://www.google.com/search?q=Ir.+MATHEN+KUMAR+A/L+RAMACHENDRAM
Ir. MAZLAN BIN DINDI,https://www.google.com/search?q=Ir.+MAZLAN+BIN+DINDI
Ir. MAZLAN BIN YUSOFF,https://www.google.com/search?q=Ir.+MAZLAN+BIN+YUSOFF
Ir. MAZNORZUHAIRI BIN MOHAMAD,https://www.google.com/search?q=Ir.+MAZNORZUHAIRI+BIN+MOHAMAD
Ir. MAZUNI BIN ABD RAHMAN,https://www.google.com/search?q=Ir.+MAZUNI+BIN+ABD+RAHMAN
Ir. MD FIKRI BIN ABDULLAH,https://www.google.com/search?q=Ir.+MD+FIKRI+BIN+ABDULLAH
Ir. MD HISMA BIN HASHIM,https://www.google.com/search?q=Ir.+MD+HISMA+BIN+HASHIM
Ir. MD ISA DAUD,https://www.google.com/search?q=Ir.+MD+ISA+DAUD
Ir. MD NASIR BIN MD ISA,https://www.google.com/search?q=Ir.+MD+NASIR+BIN+MD+ISA
Ir. MD NAZIR BIN MD KASSIM,https://www.google.com/search?q=Ir.+MD+NAZIR+BIN+MD+KASSIM
Ir. MD NUJID BIN ISMAIL,https://www.google.com/search?q=Ir.+MD+NUJID+BIN+ISMAIL
Ir. MD YUSOF BIN ISMAIL,https://www.google.com/search?q=Ir.+MD+YUSOF+BIN+ISMAIL
Ir. MD ZAHAR BIN MOHAMAD,https://www.google.com/search?q=Ir.+MD+ZAHAR+BIN+MOHAMAD
Ir. MD ZAID BIN YUNOS,https://www.google.com/search?q=Ir.+MD+ZAID+BIN+YUNOS
Ir. MD ZAINI BIN SAIRAN,https://www.google.com/search?q=Ir.+MD+ZAINI+BIN+SAIRAN
Ir. MECKOON ASSAN,https://www.google.com/search?q=Ir.+MECKOON+ASSAN
Ir. MICHAEL KWAN CHING DAO,https://www.google.com/search?q=Ir.+MICHAEL+KWAN+CHING+DAO
Ir. MICHAEL TSEN LIP-KHAH,https://www.google.com/search?q=Ir.+MICHAEL+TSEN+LIP-KHAH
Ir. MIOR SHAHAR BIN MIOR NAZRI,https://www.google.com/search?q=Ir.+MIOR+SHAHAR+BIN+MIOR+NAZRI
Ir. MO SIEW MEI,https://www.google.com/search?q=Ir.+MO+SIEW+MEI
Ir. MOBARAK BIN HUSSEIN,https://www.google.com/search?q=Ir.+MOBARAK+BIN+HUSSEIN
Ir. MOHAMAD ASRI BIN PAZIL,https://www.google.com/search?q=Ir.+MOHAMAD+ASRI+BIN+PAZIL
Ir. MOHAMAD ASRUL BIN MUSTAPHA,https://www.google.com/search?q=Ir.+MOHAMAD+ASRUL+BIN+MUSTAPHA
Ir. MOHAMAD BIN OTHMAN,https://www.google.com/search?q=Ir.+MOHAMAD+BIN+OTHMAN
Ir. MOHAMAD DZULASRI BIN HIPENY,https://www.google.com/search?q=Ir.+MOHAMAD+DZULASRI+BIN+HIPENY
Ir. MOHAMAD FAHMI BIN MAMAT @ MOHAMAD,https://www.google.com/search?q=Ir.+MOHAMAD+FAHMI+BIN+MAMAT+@+MOHAMAD
Ir. MOHAMAD FARID BIN HAJI MUSTAFA,https://www.google.com/search?q=Ir.+MOHAMAD+FARID+BIN+HAJI+MUSTAFA
Ir. MOHAMAD GHAZALAN BIN OSMAN,https://www.google.com/search?q=Ir.+MOHAMAD+GHAZALAN+BIN+OSMAN
Ir. MOHAMAD HATTA BIN ABU BAKAR,https://www.google.com/search?q=Ir.+MOHAMAD+HATTA+BIN+ABU+BAKAR
Ir. MOHAMAD KHALIS BIN MD YASIN,https://www.google.com/search?q=Ir.+MOHAMAD+KHALIS+BIN+MD+YASIN
Ir. MOHAMAD MOHAIDIN BIN AB LATIB,https://www.google.com/search?q=Ir.+MOHAMAD+MOHAIDIN+BIN+AB+LATIB
Ir. MOHAMAD MOHARDINATA BIN MOHAMAD ALI,https://www.google.com/search?q=Ir.+MOHAMAD+MOHARDINATA+BIN+MOHAMAD+ALI
Ir. MOHAMAD NAZOR BIN TAHIR,https://www.google.com/search?q=Ir.+MOHAMAD+NAZOR+BIN+TAHIR
Ir. MOHAMAD NOH BIN SERUL,https://www.google.com/search?q=Ir.+MOHAMAD+NOH+BIN+SERUL
Ir. MOHAMAD NORANI BIN MANSOR,https://www.google.com/search?q=Ir.+MOHAMAD+NORANI+BIN+MANSOR
Ir. MOHAMAD RAZAK BIN ISMAIL,https://www.google.com/search?q=Ir.+MOHAMAD+RAZAK+BIN+ISMAIL
Ir. MOHAMAD RIDZUAN BIN IDRIS,https://www.google.com/search?q=Ir.+MOHAMAD+RIDZUAN+BIN+IDRIS
Ir. MOHAMAD SAJIELI BIN PUTIT,https://www.google.com/search?q=Ir.+MOHAMAD+SAJIELI+BIN+PUTIT
Ir. MOHAMAD SURIF ABDUL WAHAB,https://www.google.com/search?q=Ir.+MOHAMAD+SURIF+ABDUL+WAHAB
Ir. MOHAMAD ZAHIMI BIN OSMAN,https://www.google.com/search?q=Ir.+MOHAMAD+ZAHIMI+BIN+OSMAN
Ir. MOHAMAD ZAINAL ABIDIN B IBRAHIM,https://www.google.com/search?q=Ir.+MOHAMAD+ZAINAL+ABIDIN+B+IBRAHIM
Ir. MOHAMAD ZAINI BIN BAKAR,https://www.google.com/search?q=Ir.+MOHAMAD+ZAINI+BIN+BAKAR
Ir. MOHAMED AZMI BIN SALIM,https://www.google.com/search?q=Ir.+MOHAMED+AZMI+BIN+SALIM
Ir. MOHAMED AZMIRA BIN MOHAMED,https://www.google.com/search?q=Ir.+MOHAMED+AZMIRA+BIN+MOHAMED
Ir. MOHAMED MOHIDEEN BIN A JAMAL MOHAMED,https://www.google.com/search?q=Ir.+MOHAMED+MOHIDEEN+BIN+A+JAMAL+MOHAMED
Ir. MOHAMED SHUHAIDI BIN OMAR,https://www.google.com/search?q=Ir.+MOHAMED+SHUHAIDI+BIN+OMAR
Ir. MOHAMED YUNUS BIN SEENI MOHAMED,https://www.google.com/search?q=Ir.+MOHAMED+YUNUS+BIN+SEENI+MOHAMED
Ir. MOHAMMAD ANUAR BIN YUSOF,https://www.google.com/search?q=Ir.+MOHAMMAD+ANUAR+BIN+YUSOF
Ir. MOHAMMAD BASAR BIN UMAR,https://www.google.com/search?q=Ir.+MOHAMMAD+BASAR+BIN+UMAR
Ir. MOHAMMAD FADZIL BIN ABDUL MANAP,https://www.google.com/search?q=Ir.+MOHAMMAD+FADZIL+BIN+ABDUL+MANAP
Ir. MOHAMMAD FAIZAL BIN KHALID,https://www.google.com/search?q=Ir.+MOHAMMAD+FAIZAL+BIN+KHALID
Ir. MOHAMMAD FAIZUL ZAINUDIN @ NORDIN,https://www.google.com/search?q=Ir.+MOHAMMAD+FAIZUL+ZAINUDIN+@+NORDIN
Ir. MOHAMMAD KHATIB BIN MAHALIL,https://www.google.com/search?q=Ir.+MOHAMMAD+KHATIB+BIN+MAHALIL
Ir. MOHAMMAD NIDZAM BIN MOHAMED BURHANUDIN,https://www.google.com/search?q=Ir.+MOHAMMAD+NIDZAM+BIN+MOHAMED+BURHANUDIN
Ir. MOHAMMAD SHAHINI BIN PUTEH,https://www.google.com/search?q=Ir.+MOHAMMAD+SHAHINI+BIN+PUTEH
Ir. MOHAMMAD ZAFWAD BIN MOHAMMAD HANZAM,https://www.google.com/search?q=Ir.+MOHAMMAD+ZAFWAD+BIN+MOHAMMAD+HANZAM
Ir. MOHAMMED DZULKIFLI B MOHAMMED,https://www.google.com/search?q=Ir.+MOHAMMED+DZULKIFLI+B+MOHAMMED
Ir. MOHAMMED FIRDHAUS BIN HAJI NAWAWI,https://www.google.com/search?q=Ir.+MOHAMMED+FIRDHAUS+BIN+HAJI+NAWAWI
Ir. MOHD A'ZMI BIN YUNUS,https://www.google.com/search?q=Ir.+MOHD+A'ZMI+BIN+YUNUS
Ir. MOHD ABDUL KARIM BIN ABDULLAH,https://www.google.com/search?q=Ir.+MOHD+ABDUL+KARIM+BIN+ABDULLAH
Ir. MOHD ADZRIE BIN RADZALI,https://www.google.com/search?q=Ir.+MOHD+ADZRIE+BIN+RADZALI
Ir. MOHD AFZAL BIN MOHD DITALI,https://www.google.com/search?q=Ir.+MOHD+AFZAL+BIN+MOHD+DITALI
Ir. MOHD ARAFAT B ABDUL RASHID,https://www.google.com/search?q=Ir.+MOHD+ARAFAT+B+ABDUL+RASHID
Ir. MOHD ARIFIN BIN SAMINGUN,https://www.google.com/search?q=Ir.+MOHD+ARIFIN+BIN+SAMINGUN
Ir. MOHD ASRI BIN MOHD NOR,https://www.google.com/search?q=Ir.+MOHD+ASRI+BIN+MOHD+NOR
Ir. MOHD ASWADI BIN TON ALIAS,https://www.google.com/search?q=Ir.+MOHD+ASWADI+BIN+TON+ALIAS
Ir. MOHD AZHAR BIN ABDUL RAHMAN,https://www.google.com/search?q=Ir.+MOHD+AZHAR+BIN+ABDUL+RAHMAN
Ir. MOHD AZHARI BIN CHE OMAR,https://www.google.com/search?q=Ir.+MOHD+AZHARI+BIN+CHE+OMAR
Ir. MOHD AZIZAN BIN ABDUL RAZAK @ RAJAB,https://www.google.com/search?q=Ir.+MOHD+AZIZAN+BIN+ABDUL+RAZAK+@+RAJAB
Ir. MOHD AZLAN BIN ABAS,https://www.google.com/search?q=Ir.+MOHD+AZLAN+BIN+ABAS
Ir. MOHD AZMI BIN ASIF,https://www.google.com/search?q=Ir.+MOHD+AZMI+BIN+ASIF
Ir. MOHD AZMI BIN HASHIM,https://www.google.com/search?q=Ir.+MOHD+AZMI+BIN+HASHIM
Ir. MOHD AZRUL NIZAM BIN MOHD ZAHIR,https://www.google.com/search?q=Ir.+MOHD+AZRUL+NIZAM+BIN+MOHD+ZAHIR
Ir. MOHD AZWIRA BIN MOHD AZMI,https://www.google.com/search?q=Ir.+MOHD+AZWIRA+BIN+MOHD+AZMI
Ir. MOHD DAIMAN BIN HAJI YUNUS,https://www.google.com/search?q=Ir.+MOHD+DAIMAN+BIN+HAJI+YUNUS
Ir. MOHD FADHIR BIN AKHKAR ALI,https://www.google.com/search?q=Ir.+MOHD+FADHIR+BIN+AKHKAR+ALI
Ir. MOHD FADZLILLAH BIN MOHAMOOD,https://www.google.com/search?q=Ir.+MOHD+FADZLILLAH+BIN+MOHAMOOD
Ir. MOHD FAIRUZ BIN HARON,https://www.google.com/search?q=Ir.+MOHD+FAIRUZ+BIN+HARON
Ir. MOHD FAIZ AMIR MOHD SHITH,https://www.google.com/search?q=Ir.+MOHD+FAIZ+AMIR+MOHD+SHITH
Ir. MOHD FAIZ BIN SALIM,https://www.google.com/search?q=Ir.+MOHD+FAIZ+BIN+SALIM
Ir. MOHD FARID BIN JAMLUS,https://www.google.com/search?q=Ir.+MOHD+FARID+BIN+JAMLUS
Ir. MOHD FAUZI BIN SHAFIE,https://www.google.com/search?q=Ir.+MOHD+FAUZI+BIN+SHAFIE
Ir. MOHD FAZIDIN BIN FAISAL,https://www.google.com/search?q=Ir.+MOHD+FAZIDIN+BIN+FAISAL
Ir. MOHD HAFIZ BIN ABDULLAH,https://www.google.com/search?q=Ir.+MOHD+HAFIZ+BIN+ABDULLAH
Ir. MOHD HAFIZ BIN MOHD ALI,https://www.google.com/search?q=Ir.+MOHD+HAFIZ+BIN+MOHD+ALI
Ir. MOHD HAFIZI BIN AHMAD,https://www.google.com/search?q=Ir.+MOHD+HAFIZI+BIN+AHMAD
Ir. MOHD HANAFIAH B BESAR SA'AID,https://www.google.com/search?q=Ir.+MOHD+HANAFIAH+B+BESAR+SA'AID
Ir. MOHD HATTA BIN ZAKARIA,https://www.google.com/search?q=Ir.+MOHD+HATTA+BIN+ZAKARIA
Ir. MOHD HAZERY BIN MD SHAMSI,https://www.google.com/search?q=Ir.+MOHD+HAZERY+BIN+MD+SHAMSI
Ir. MOHD HAZLI BIN HASHIM,https://www.google.com/search?q=Ir.+MOHD+HAZLI+BIN+HASHIM
Ir. MOHD HAZZAH BIN AHMAD SIRON,https://www.google.com/search?q=Ir.+MOHD+HAZZAH+BIN+AHMAD+SIRON
Ir. MOHD HELMI BIN ABDUL AZIZ,https://www.google.com/search?q=Ir.+MOHD+HELMI+BIN+ABDUL+AZIZ
Ir. MOHD HISAM BIN SA'AT,https://www.google.com/search?q=Ir.+MOHD+HISAM+BIN+SA'AT
Ir. MOHD HISHAM BIN IBRAHIM,https://www.google.com/search?q=Ir.+MOHD+HISHAM+BIN+IBRAHIM
Ir. MOHD IMRAN BIN ABDUL HAMID,https://www.google.com/search?q=Ir.+MOHD+IMRAN+BIN+ABDUL+HAMID
Ir. MOHD JARISMAN BIN ABDUL JALIL,https://www.google.com/search?q=Ir.+MOHD+JARISMAN+BIN+ABDUL+JALIL
Ir. MOHD KAMAL AZMEY B AWANG HITAM,https://www.google.com/search?q=Ir.+MOHD+KAMAL+AZMEY+B+AWANG+HITAM
Ir. MOHD KAMAL BIN MISDAR,https://www.google.com/search?q=Ir.+MOHD+KAMAL+BIN+MISDAR
Ir. MOHD KAMAL HAZIQ BIN KAMARUZAMAN,https://www.google.com/search?q=Ir.+MOHD+KAMAL+HAZIQ+BIN+KAMARUZAMAN
Ir. MOHD KASHFI BIN MOHD YUSOF,https://www.google.com/search?q=Ir.+MOHD+KASHFI+BIN+MOHD+YUSOF
Ir. MOHD KHAIRUL ANUAR BIN SHARIF,https://www.google.com/search?q=Ir.+MOHD+KHAIRUL+ANUAR+BIN+SHARIF
Ir. MOHD KHOUSHAINI BIN MOHD NAIM,https://www.google.com/search?q=Ir.+MOHD+KHOUSHAINI+BIN+MOHD+NAIM
Ir. MOHD MUSTAFA BIN ZAHARIMAN,https://www.google.com/search?q=Ir.+MOHD+MUSTAFA+BIN+ZAHARIMAN
Ir. MOHD MUZAKKIR BIN ABDULLAH,https://www.google.com/search?q=Ir.+MOHD+MUZAKKIR+BIN+ABDULLAH
Ir. MOHD NAIMIE BIN MAZID,https://www.google.com/search?q=Ir.+MOHD+NAIMIE+BIN+MAZID
Ir. MOHD NAJIB HAMSAN,https://www.google.com/search?q=Ir.+MOHD+NAJIB+HAMSAN
Ir. MOHD NAWI BIN SALLEH,https://www.google.com/search?q=Ir.+MOHD+NAWI+BIN+SALLEH
Ir. MOHD NAZARI BIN HJ JAFFAR,https://www.google.com/search?q=Ir.+MOHD+NAZARI+BIN+HJ+JAFFAR
Ir. MOHD NAZIR BIN MANSOR,https://www.google.com/search?q=Ir.+MOHD+NAZIR+BIN+MANSOR
Ir. MOHD NAZMI BIN MOHD NAGEEB,https://www.google.com/search?q=Ir.+MOHD+NAZMI+BIN+MOHD+NAGEEB
Ir. MOHD NAZRI BIN MAT HAN,https://www.google.com/search?q=Ir.+MOHD+NAZRI+BIN+MAT+HAN
Ir. MOHD NAZRI BIN MOHAMAD,https://www.google.com/search?q=Ir.+MOHD+NAZRI+BIN+MOHAMAD
Ir. MOHD NAZRI BIN MOHD JAMIL,https://www.google.com/search?q=Ir.+MOHD+NAZRI+BIN+MOHD+JAMIL
Ir. MOHD NIZAM BIN AB WAHAB,https://www.google.com/search?q=Ir.+MOHD+NIZAM+BIN+AB+WAHAB
Ir. MOHD NIZAM BIN ABDUL RAHIM @ SALLEH,https://www.google.com/search?q=Ir.+MOHD+NIZAM+BIN+ABDUL+RAHIM+@+SALLEH
Ir. MOHD NIZAR BIN WAN JAAFAR,https://www.google.com/search?q=Ir.+MOHD+NIZAR+BIN+WAN+JAAFAR
Ir. MOHD NOOR BIN HASHIM,https://www.google.com/search?q=Ir.+MOHD+NOOR+BIN+HASHIM
Ir. MOHD NOOR BIN SEHAT,https://www.google.com/search?q=Ir.+MOHD+NOOR+BIN+SEHAT
Ir. MOHD NOOR BIN ZAINUDIN,https://www.google.com/search?q=Ir.+MOHD+NOOR+BIN+ZAINUDIN
Ir. MOHD NORAZMAN BIN MOHD SHARKAWI,https://www.google.com/search?q=Ir.+MOHD+NORAZMAN+BIN+MOHD+SHARKAWI
Ir. MOHD NORMARZUKI YA'ACOB,https://www.google.com/search?q=Ir.+MOHD+NORMARZUKI+YA'ACOB
Ir. MOHD QAHARUDDIN BIN ABDULLAH,https://www.google.com/search?q=Ir.+MOHD+QAHARUDDIN+BIN+ABDULLAH
Ir. MOHD RADZI BIN DAHALAN,https://www.google.com/search?q=Ir.+MOHD+RADZI+BIN+DAHALAN
Ir. MOHD RADZI BIN SALLEH,https://www.google.com/search?q=Ir.+MOHD+RADZI+BIN+SALLEH
Ir. MOHD RADZI ISMAIL,https://www.google.com/search?q=Ir.+MOHD+RADZI+ISMAIL
Ir. MOHD RASHIDI BIN MAAROF,https://www.google.com/search?q=Ir.+MOHD+RASHIDI+BIN+MAAROF
Ir. MOHD RAZIF BIN ABD HALIM,https://www.google.com/search?q=Ir.+MOHD+RAZIF+BIN+ABD+HALIM
Ir. MOHD ROSE RIZAL BIN MOHAMAD RASIDI,https://www.google.com/search?q=Ir.+MOHD+ROSE+RIZAL+BIN+MOHAMAD+RASIDI
